inputs.question,inputs.answer,inputs.context,inputs.ground_truth,gpt_similarity,gpt_coherence,gpt_fluency,gpt_groundedness,gpt_relevance,f1_score,index,status
"What is the name of the person who sent the initial email regarding pulling for Enron and the attached Attack_on_Taliban.mp3 file?","The person who sent the initial email regarding pulling for Enron and the attached Attack_on_Taliban.mp3 file is Jim Easter.","['pulling for enron. i hope the bank deal comes through quickly. i wonder which beach af is on right now. i thought i would pass this along in case you need a laugh. jim (see attached file: attack_on_taliban.mp3) _____________________________ jim easter reliant energy solutions transaction development & support 713-207-3170 - office 713-898-9481 - mobile 877-330-0952 - pager jeaster@reliant.com fyi, rick buy ryan, in the follow up to the meeting we had on wednesday i would like to reinforce one point i made. i feel strongly that i cannot support the valuations my group has produced so far for the ljm/raptor related transactions without examination of all the related legal documents. i feel that we did solid work based on verbal information, but i cannot guarantee the quality of the final product without looking at the contracts. these transactions are too complex and controversial to bypass due diligence requirements that you would expect from any professional', '. jim (see attached file: attack_on_taliban.mp3) _____________________________ jim easter reliant energy solutions transaction development & support 713-207-3170 - office 713-898-9481 - mobile 877-330-0952 - pager jeaster@reliant.com amusing attachment. rick rick. hang in there. beleive it or not, everyone in the industry i talk with is pulling for enron. i hope the bank deal comes through quickly. i wonder which beach af is on right now. i thought i would pass this along in case you need a laugh. jim (see attached file: attack_on_taliban.mp3) _____________________________ jim easter reliant energy solutions transaction development & support 713-207-3170 - office 713-898-9481 - mobile 877-330-0952 - pager jeaster@reliant.com thought you might like the attachment. love, dad rick. hang in there. beleive it or not, everyone in the industry i talk with is pulling for enron. i hope the bank deal comes through quickly. i wonder which beach af is on right now', '. we will be in touch soon with more details. regards, ken lay a ok for me could you kindly provide me with your revisions, if any, as soon as possible. thanks, nella gentlemen, you have recently received hard copies of the 3rd quarter soft targets. attached for your reference are the electronic versions of the soft targets. paul, your hard copies will arrive on monday. regards, nella << file: q3softtargets.xls >> << file: 3q orig detail.xls >> << file: 3q counterparty detail.xls >> << file: midmkt.orig2000 vs. 2001a.xls >> << file: eol 2000 vs. 2001 sep.xls >> << file: new counterparties.xls >> jzufferli@shaw.ca, it has changed from jzufferli@home.com zuf: what is your home email address again? in hoc, smith _________________________________________________________________ get your free download of msn explorer at http://explorer.msn.com/intl.asp can you explain to me what data you are pulling for canadian fixed price positions in the report, it showed chris lambie selling 1200 contracts yesterday', '. would you like to insert it and we will initial? thanks. sara sara shackleton enron wholesale services 1400 smith street, eb3801a houston, tx 77002 ph: (713) 853-5620 fax: (713) 646-3490 would it be possible for you to forward a corporate resolution indicating that the signatory on the guaranty has full authorirization? thanks in advance for your help lauri goodwyn 11/08/2001 10:54 am (embedded image moved to file: pic24464.pcx) apparently there has been a technical issue with the e mail i sent. it hasnt picked up all of the changes. i am bolding instead of using highlighting. the changes should be in para 1(b), 3(c), 4 and 7. i had a question in para 6. (see attached file: enronguarred.doc) fimat usa inc., a member of the nasd and sipc, and a broker dealer and futures commission merchant registered under u.s. laws, makes no representation or warranty regarding the correctness of any information contained herein, or the appropriateness of any transaction for any person', '. as mentioned in the previous communication, this was the first of several communications to be sent by the enron global technology group and we will continue to provide more details in the coming weeks regarding this significant but necessary change to our email environment. we are working toward a cut-off date of january 14, 2002, at which time we will no longer support email addresses that do not follow the standard format of firstname.lastname@enron.com (or firstname.middleinitial.lastname@enron.com if your name in lotus notes or outlook has a middle initial in it). we understand that it will take time to make the necessary arrangements to begin using the standard email address format, but it is important to begin making the change now. if you have questions, please send an email to enron.messaging.administration@enron.com. thank you for your support. enron global technology enron global technology is in the process of decommissioning the support for all non-standard internet email address formats']","Jim Easter","5","5","3","1","1","0.22","1","-"
"What is the name of the person from the University who is handling the Excellence Fund awards, and when does he plan to have the Excellence Fund dinner?","The person from the University who is handling the Excellence Fund awards is Ramesh Rao, who is the Associate Dean. He plans to have the Excellence Fund dinner in the fall when all of the awardees have been chosen.","['. i have an intuitive explanation based on probability trees. my wishes of a good weekend, giuseppe vince, good morning. as you may know, last thur. enron honored this year is recipients of the enron mba excellence fund scholars at a dinner in austin. in addition to the three recipients, business school dean may and several of my colleagues, enron attendees included sally beck, cindy justice, karen marshall (newly-appointed coordinator of higher education initiatives for enron community relations dept.) and rick causey. i write you at this time to advise you i had occasion to discuss two current enron/ut issues with rick: i. spring 2001 conference participation by jeffrey k. skilling ii. ut participation in enrontraining activities per my conversation with rick last thur., i followed up on that discussion with an e-mail this morn that touched on those two topics. i. with respect to the first, i wrote rick this morning that: 1', '. i have also volunteered to coordinate with the university on appropriate attendees, as some of karen is info is dated and she does not know people at the school. i will keep you posted. --sally attached is the enron mba excellence fund scholars dinner invitation. rsvp karen marshall at 713-853-7632 or melinda nelson at 512-471-7603. was lisa a recent hire that susan harrison brought in? i do not immediately recognize her name, but wonder if that is who this is. also, i left you a message about bob klein is resignation, as i learned from jeff sorenson. i am sure that jeff has communicated this to you. --sally sally, fyi, lisa peterson turned in her voluntary resignation today and it is effective today by her own choice. she has personal issues that she feels she needs to take care of and she also reported that the job was not what she had hoped for. we have her resignation letter on file', 'thanks! elyse susan white <susan.white@bus.utexas.edu> on 04/06/2000 10:19:12 am hi elyse - i just spoke with ramesh rao (associate dean). he has not yet made the excellence fund awards, which are also part of the enron endowment. he would like to have the dinner in the fall, when all of the awardees have been chosen. he felt that a dinner the end of april would conflict with a major e-commerce conference we are having here, and the enron awards would get the attention they deserve in the fall. the other advantage of a fall dinner is that the new students will be here, and if we have a big announcement then, they can see what they have to look forward to. will this work for you? thanks. sue sue: thanks for your email. in speaking with rick causey, the only day that he is available is monday, april 24. in speaking with sally beck, i know that you are confirming the 3 winners and will get me their info once they have been chosen', '. she will most likely then contact you to confirm their names. i have phone numbers, addresses and e:mail addresses for all three, and i will provide you with those as soon as the official notification from the university takes place. gene, thomas and roger are all interested in attending the dinner in austin if schedules permit. the week of april 24th is a good one for me for the dinner. obviously, many schedules have to be coordinated. i know that rick causey will want to attend (he will have been in london the week prior, so he may be available). i have also talked with cindy olson and i know that she would like to be included if her schedule permits. today was brent is last day in the houston office for several months. let me know how i can help with these arrangements. sue: greetings! we have not spoken in awhile, but i wanted to touch base with you regarding the mba excellence awards and specifically hosting a dinner similar to last year is event at jeffrey is', '. we have her resignation letter on file. hgm please print the attachment for me in color ( i have to put that burnt orange on my bulletin board), put this event on my calendar and research flight information for me. i would fly over on the afternoon of the 7th and back on the morning of the 8th. check with karen to see if she is handling hotel reservations, or if we should make those. thanks. attached is the enron mba excellence fund scholars dinner invitation. rsvp karen marshall at 713-853-7632 or melinda nelson at 512-471-7603. please print this memo and attachments in color for me. thanks. --sally sent by: enron announcements@enron as a follow-up to the recent enron corp. memorandum forming enron wholesale services (ews), effective today, we have reorganized the wholesale services legal department']","Ramesh Rao","1","5","4","3","3","0.12","2","-"
"Who is the author of the column in the San Francisco Chronicle that discusses the energy situation and criticizes Governor Gray Davis?","The author of the column in the San Francisco Chronicle that discusses the energy situation and criticizes Governor Gray Davis is Dan Schnur.","['.sce.com ( content technologies smtprs 2.0.15) with esmtp id <b0005981399@go2ntswpr01.sce.com>; wed, 28 feb 2001 13:48:23 -0800 to all parties on the e-mail service list for a.00-11-038: attached is a copy of the joint application of sce and pg&e for rehearing of d.01-01-06 which was filed today, february 28, 2001. a copy is also being served to all parties of record via u.s. mail. (see attached file: jointapp.pdf) - jointapp.pdf the author is a very well-know republican, dan schnur. needed - star to guide us as gov. gray davis gets the state deeper into the energy business, puc chair is no bright light dan schnur wednesday, february 28, 2001 ,2001 san francisco chronicle url: http://www.sfgate.com/cgi-bin/article.cgi?file=/chronicle/archive/2001/02/28/e d102858', '. * times staff writer nancy rivera brooks in los angeles contributed to this= =20 story.=20 copyright 2001, los angeles times=20 state is refund demand rejected=20 judge ends rebate talks, rebukes $9 billion claim=20 zachary coile, christian berthelsen, chronicle staff writers tuesday, july 10, 2001=20 ,2001 san francisco chronicle=20 url: http://www.sfgate.com/cgi-bin/article.cgi?f=3d/c/a/2001/07/10/mn117914= .dtl=20 washington -- an administrative law judge, delivering a powerful message to= =20 gov. gray davis and california energy officials, cast aside the state is cla= im=20 that it is owed $8.9 billion in electricity overcharges by generators and= =20 called for further hearings to determine ""hard numbers.""=20 the judge, ending talks designed to settle the dispute between california a= nd=20 power sellers, said the state and its cash-strapped utilities may owe more = in=20 unpaid electricity bills than they are owed for overcharges by the=20 generators', '. e-mail the writers at zcoile@sfchronicle.com . and cber= thelsen@sfchronicle.com ., zachary coile reported from washington, d.c., an= d christian berthelsen in san francisco. ?2001 san francisco chronicle = page a - 1 davis opens another new power plant pittsburg facility wil= l generate 555 megawatts bernadette tansey, chronicle staff writer tuesda= y, july 10, 2001 ?2001 san francisco chronicle url: http://www.sfgate.co= m/cgi-bin/article.cgi?f=3d/c/a/2001/07/10/mn175828.dtl pittsburg -- wo= rkers were still scraping wet concrete on support columns as gov. gray davi= s celebrated the startup of a new power plant in pittsburg yesterday -- the= latest in a string of openings davis hopes will help california ""build its= way"" out of the energy crisis. the state rushed to throw as many megawatts= on line as it could when it looked like the summer would feature regular b= lackouts, and yesterday the governor said it was paying off', '. kroll was also quoted in the san francisco chronicle ton march 27 and appeared on kpix news and ktvu channel 2. in the past two weeks, severin borenstein, appeared on npr is ""talk of the nation,"" kcbs radio, kpix tv news, kron tv news, kgo radio, kcrw (npr in la) on ""which way la"", npr talk of the nation, kron news, npr all things considered, kpfk radio, and kgo radio. borenstein was quoted in: the los angeles times on march 22 in ""energy overcharge of $5.5 billion is alleged"" businessweek on march 26 in ""how to do deregulation right"" the san diego union tribune in ""expertise on energy no longer academic."" borenstein was also quoted in ""contracts will not meet summer demands"" in the san francisco chronicle on the california energy crisis. read the full text at http://www.sfgate.com/cgi-bin/article.cgi?file=/chronicle/archive/2001/03/22/m n230640.dtl', '. * times staff writer nancy rivera brooks in los angel= es contributed to this story. copyright 2001, los angeles times sta= te is refund demand rejected judge ends rebate talks, rebukes $9 billion cl= aim zachary coile, christian berthelsen, chronicle staff writers tuesday,= july 10, 2001 ?2001 san francisco chronicle url: http://www.sfgate.com/= cgi-bin/article.cgi?f=3d/c/a/2001/07/10/mn117914.dtl washington -- an adm= inistrative law judge, delivering a powerful message to gov. gray davis and= california energy officials, cast aside the state is claim that it is owed = $8.9 billion in electricity overcharges by generators and called for furthe= r hearings to determine ""hard numbers."" the judge, ending talks designed t= o settle the dispute between california and power sellers, said the state a= nd its cash-strapped utilities may owe more in unpaid electricity bills tha= n they are owed for overcharges by the generators']","Rob Morse","2","3","3","1","1","0","3","-"
"What are the proposed terms for the rate increase according to the CPUC?","The proposed terms for the rate increase according to the CPUC and Governor Gray Davis involve a 15-percent rate hike for the utilities. However, there is speculation that the CPUC will approve an increase for extra costs that will be applied in increments over the course of 2001. This incremental approach could result in an ultimate rate increase somewhere in the range of 15 percent to 30 percent (or more), offering a compromise to both the utilities and the consumers. The utilities will receive a rate increase closer to what they claim is necessary, while utility customers will not face an immediate, all-at-once increase in their electricity bills. Additionally, the CPUC is not expected to approve any back billing that the utilities have demanded.","['. as we wait with anticipation to hear what the cpuc will decide, let is recap some of the issues that will no doubt continue to cause great dissension among the primary players in california. as has been well documented, pgoand sce are in a massive amount of debt due to uncollected costs they have accrued related to the purchase of power on the wholesale market. due to rate freezes still in place, both utilities have been unable to charge customers for the dramatic increase in the price of wholesale power, which has placed them both on the brink of bankruptcy. from several conversations with my contacts in california, here is my understanding of where the negotiations currently stand. the cpuc already has agreed in theory to a rate increase, but the sticking point is the specific amount of that increase. reportedly, the cpuc and gov. gray davis proposed a 15-percent rate hike to the two utilities', '. reportedly, the cpuc and gov. gray davis proposed a 15-percent rate hike to the two utilities. in sharp contrast, pgomaintains that it needs to increase rates by as much as 40 percent, and sce says that it wants an increase of 30 percent (or 76 percent over two years). in fact, pgoalready began notifying customers last week that it wants to boost their electric bills by that specific amount. both utilities continue to argue that even if their proposed rate increases are accepted, they still may not be enough to cover wholesale costs, which are projected to rise through 2003 (see my issuealert from dec. 29). in addition, pgoand sce also claim that their financial solvency still will not be guaranteed even if their rate increase proposals are accepted, and bankruptcy will be very likely if the cpuc only allows them to increase rates by 15 percent. over the last few weeks, pressure was put on the federal energy regulatory commission (ferc) to step in and solve the problem', '. davis, a democrat, to keep any rate increase given to the utilities to a minimum. in fact, last week nader stated that davis\' political future ""hangs by a kilowatt hour"" and that any decisions made in california will ""reverberate all over the country."" in essence, consumer groups believe that utilities share the bulk of responsibility for the current mess in the state, as they played a large role in california is 1996 restructuring legislation. if mistakes were made in that legislation, consumer groups say, the utilities and not utility customers should be made to pay the price. speculation is growing that, on jan. 4, the cpuc will approve an increase for extra costs that will be applied in increments over the course of 2001, resulting in an ultimate rate increase that is somewhere in the range of 15 percent to 30 percent (or more). this in effect will offer a compromise to both sides', '. this in effect will offer a compromise to both sides. the utilities will receive a rate increase closer to what they claim is necessary, and utility customers will not get slapped with an immediate, all-at-once increase in their electricity bills. however, the cpuc probably will not approve any back billing that the utilities have also demanded. both pgoand sce have claimed that their stranded costs were probably paid off months ago, meaning that the rate freeze still in place for both utilities should have been lifted as a result. that theory being accurate, both companies want to bill their customers retroactively to the date that the rate freeze should have been lifted, which on its own could amount to several billions of dollars. under the current arrangement, the rate freeze is scheduled to stay in effect until march 2002, unless lifted by the cpuc. meanwhile, the question about the financial solvency of both pgoand sce continues to loom', "". moreo= ver, after consumers' fuel/purchased power adjustment clause is reinstated= , we could reneotiate the contract downwards and pass on a small savings (a= gain, a rate decrease)to customers and we and consumers could split the lio= n is share of the savings revenue. lastly, but more significantly, the mich= igan law that pertains to utilities recovering qf costs through rates only = provides authority to the commission to review ppa changes if the costs for= power and energy increase. our proposed changes are not likely to be deem= ed to be a rate increase. generally an unchanged rate for a service with a= declining quality of service ( e.g., a firm transport service changed to a= n interruptible service at the same rate)could be construed as a rate incre= ase thus triggering the commission is authority""]","A 1 cent/kwh charge for all customers","1","3","1","3","4","0.04","4","-"
"Which subject in the documents is set for an appointment on 04/03/2000 at 04:00 PM?","The provided information does not specify the subject of the appointments. It only includes details such as dates, times, and the individual associated with the appointments (John M. Forney). Specifically, for the appointment on 04/03/2000 at 04:00 PM, the data mentions:

- `<omnicalendardatetime>04/03/2000 03:00:00 pm</omnicalendardatetime>`
- `<omnistartdate>04/03/2000 03:00:00 pm</omnistartdate>`
- `<omnistartdatetime>04/03/2000 03:00:00 pm</omnistartdatetime>`
- `<omnioriginaldatetime>04/03/2000 03:00:00 pm</omnioriginaldatetime>`
- `<omniremindertime>04/03/2000 03:00:00 pm</omniremindertime>`
- `<omnienddatetime>04/03/2000 04:00:00 pm</omnienddatetime>`

However, there is no mention of the specific subject of the appointment.","[':40:24 pm</omnicreateddate> <omniform>appointment</omniform> <omniexcludefromview>d</omniexcludefromview> <omni$publicaccess>1</omni$publicaccess> <omnichair>cn=3djohn m forney/ou=3dhou/o=3dect</omnichair> <omniorgtable>c0</omniorgtable> <omni$busyname>cn=3djohn m forney/ou=3dhou/o=3dect</omni$busyname> <omni$busy>1</omni$busy> <omni$busypriority>1</omni$busypriority> <omniprincipal>cn=3djohn m forney/ou=3dhou/o=3dect</omniprincipal> <omniappointmenttype>0</omniappointmenttype> <omni_viewicon>160</omni_viewicon> <omnicalendardatetime>04/03/2000 07:00:00 pm</omnicalendardatetime> <omnistartdate>04/03/2000 07:00:00 pm</omnistartdate> <omnistartdatetime>04/03/2000 07:00:00 pm</omnistartdatetime> <omnioriginaldatetime>04/03/2000 07:00:00 pm</omnioriginaldatetime> <omniremindertime>04/03/2000 07:00:00 pm</omniremindertime> <omnienddatetime>04/03/2000 08:00:00 pm</omnienddatetime> <omni$nopurge>04/03/2000 08:00:00 pm</omni$nopurge> <omnitimerange>04/03/2000 07:00:00 pm-04/03/2000 08:00', ':40:23 pm</omnicreateddate> <omniform>appointment</omniform> <omniexcludefromview>d</omniexcludefromview> <omni$publicaccess>1</omni$publicaccess> <omnichair>cn=3djohn m forney/ou=3dhou/o=3dect</omnichair> <omniorgtable>c0</omniorgtable> <omni$busyname>cn=3djohn m forney/ou=3dhou/o=3dect</omni$busyname> <omni$busy>1</omni$busy> <omni$busypriority>1</omni$busypriority> <omniprincipal>cn=3djohn m forney/ou=3dhou/o=3dect</omniprincipal> <omniappointmenttype>0</omniappointmenttype> <omni_viewicon>160</omni_viewicon> <omnicalendardatetime>04/03/2000 05:00:00 pm</omnicalendardatetime> <omnistartdate>04/03/2000 05:00:00 pm</omnistartdate> <omnistartdatetime>04/03/2000 05:00:00 pm</omnistartdatetime> <omnioriginaldatetime>04/03/2000 05:00:00 pm</omnioriginaldatetime> <omniremindertime>04/03/2000 05:00:00 pm</omniremindertime> <omnienddatetime>04/03/2000 06:00:00 pm</omnienddatetime> <omni$nopurge>04/03/2000 06:00:00 pm</omni$nopurge> <omnitimerange>04/03/2000 05:00:00 pm-04/03/2000 06:00', ':40:24 pm</omnicreateddate> <omniform>appointment</omniform> <omniexcludefromview>d</omniexcludefromview> <omni$publicaccess>1</omni$publicaccess> <omnichair>cn=3djohn m forney/ou=3dhou/o=3dect</omnichair> <omniorgtable>c0</omniorgtable> <omni$busyname>cn=3djohn m forney/ou=3dhou/o=3dect</omni$busyname> <omni$busy>1</omni$busy> <omni$busypriority>1</omni$busypriority> <omniprincipal>cn=3djohn m forney/ou=3dhou/o=3dect</omniprincipal> <omniappointmenttype>0</omniappointmenttype> <omni_viewicon>160</omni_viewicon> <omnicalendardatetime>04/03/2000 08:30:00 pm</omnicalendardatetime> <omnistartdate>04/03/2000 08:30:00 pm</omnistartdate> <omnistartdatetime>04/03/2000 08:30:00 pm</omnistartdatetime> <omnioriginaldatetime>04/03/2000 08:30:00 pm</omnioriginaldatetime> <omniremindertime>04/03/2000 08:30:00 pm</omniremindertime> <omnienddatetime>04/03/2000 09:30:00 pm</omnienddatetime> <omni$nopurge>04/03/2000 09:30:00 pm</omni$nopurge> <omnitimerange>04/03/2000 08:30:00 pm-04/03/2000 09:30', ':40:23 pm</omnicreateddate> <omniform>appointment</omniform> <omniexcludefromview>d</omniexcludefromview> <omni$publicaccess>1</omni$publicaccess> <omnichair>cn=3djohn m forney/ou=3dhou/o=3dect</omnichair> <omniorgtable>c0</omniorgtable> <omni$busyname>cn=3djohn m forney/ou=3dhou/o=3dect</omni$busyname> <omni$busy>1</omni$busy> <omni$busypriority>1</omni$busypriority> <omniprincipal>cn=3djohn m forney/ou=3dhou/o=3dect</omniprincipal> <omniappointmenttype>0</omniappointmenttype> <omni_viewicon>160</omni_viewicon> <omnicalendardatetime>04/03/2000 03:00:00 pm</omnicalendardatetime> <omnistartdate>04/03/2000 03:00:00 pm</omnistartdate> <omnistartdatetime>04/03/2000 03:00:00 pm</omnistartdatetime> <omnioriginaldatetime>04/03/2000 03:00:00 pm</omnioriginaldatetime> <omniremindertime>04/03/2000 03:00:00 pm</omniremindertime> <omnienddatetime>04/03/2000 04:00:00 pm</omnienddatetime> <omni$nopurge>04/03/2000 04:00:00 pm</omni$nopurge> <omnitimerange>04/03/2000 03:00:00 pm-04/03/2000 04:00', ':40:25 pm</omnicreateddate> <omniform>appointment</omniform> <omniexcludefromview>d</omniexcludefromview> <omni$publicaccess>1</omni$publicaccess> <omnichair>cn=3djohn m forney/ou=3dhou/o=3dect</omnichair> <omniorgtable>c0</omniorgtable> <omni$busyname>cn=3djohn m forney/ou=3dhou/o=3dect</omni$busyname> <omni$busy>1</omni$busy> <omni$busypriority>1</omni$busypriority> <omniprincipal>cn=3djohn m forney/ou=3dhou/o=3dect</omniprincipal> <omniappointmenttype>0</omniappointmenttype> <omni_viewicon>160</omni_viewicon> <omnicalendardatetime>04/04/2000 02:00:00 pm</omnicalendardatetime> <omnistartdate>04/04/2000 02:00:00 pm</omnistartdate> <omnistartdatetime>04/04/2000 02:00:00 pm</omnistartdatetime> <omnioriginaldatetime>04/04/2000 02:00:00 pm</omnioriginaldatetime> <omniremindertime>04/04/2000 02:00:00 pm</omniremindertime> <omnienddatetime>04/04/2000 03:00:00 pm</omnienddatetime> <omni$nopurge>04/04/2000 03:00:00 pm</omni$nopurge> <omnitimerange>04/04/2000 02:00:00 pm-04/04/2000 03:00']","PSPL Problem","1","5","1","3","1","0","5","-"
"What is the anticipated worth per share of ENE according to the GS report?","The anticipated worth per share of ENE according to the Goldman Sachs (GS) report is $68/share.","['apparently gs is going to issue a report saying ene is worth $68 a share. chris once upon a time in the kingdom of heaven, god went missing for six days. eventually, michael the archangel found him, resting on the seventh day. he inquired of god, ""where have you been?"" god sighed a deep sigh of satisfaction and proudly pointed downwards through the clouds, ""look michael, look what i have made."" archangel michael looked puzzled and said, ""what is it?"" ""it is a planet,"" replied god, ""and i have put life on it. i am going to call it earth and it is going to be a great place of balance."" ""balance?"" inquired michael, still confused. god explained, pointing to different parts of earth, ""for example, northern europe will be a place of great opportunity and wealth while southern europe is going to be poor; the middle east over there will be a hot spot. over there i have placed a continent of white people and over there is a continent of black people,"" god continued, pointing to different countries', '. mandelblatt (new york) 1 212-357-7547 - investment research ===================== note 6:20 am march 29, 2001 ===================== stk latest 52 week mkt cap ytd pr cur rtg close range (mm) change yield --- ------ ------- ------- ------ ----- enron corp. rl 58.10 90-55 43374.6 -30% 0.9% --------------earnings per share--------------- ene (us$) mar jun sep dec fy cy 2002 fy 2001 fy 0.46 1.80 2000 fy(a) 0.40 0.34 0.34 0.41 1.47 -abs p/e on- -rel p/e on-- ev/nxtfy lt eps cur nxt cur nxt ebitda growth ----- ----- ----- ----- -------- ------ ene fy 32.3x nmx 1', '. fyi goldman, sachs & co. investment research ene: this overachiever is underperceived even as prospects improve: buy david fleischer, cfa (new york) 1 212-902-6018 - investment research david maccarrone, cfa (new york) 1 212-902-0324 - investment research eric w. mandelblatt (new york) 1 212-357-7547 - investment research ===================== note 6:20 am march 29, 2001 ===================== stk latest 52 week mkt cap ytd pr cur rtg close range (mm) change yield --- ------ ------- ------- ------ ----- enron corp. rl 58.10 90-55 43374.6 -30% 0.9% --------------earnings per share--------------- ene (us$) mar jun sep dec fy cy 2002 fy 2001 fy 0.46 1.80 2000 fy(a) 0.40 0.34 0.34 0.41 1.47 -abs p/e on- -rel p/e on-- ev/nxtfy lt eps cur nxt cur nxt ebitda growth ----- ----- ----- ----- -------- ------ ene fy 32.3x nmx 1', '. maybe jacques should call him if he does not hear from him by the end of the day. jeff smith the smith company 2714 bee cave road, suite 100-d austin, texas 78746 512-732-0009 512-732-0010 fax 512-751-9728 mobile for your information - this morning goldman issued a brief report following their visit with enron management on monday. their revised price target is $68/share. many of the recent issues driving causing downward pressure on the stock are discussed. goldman will be hosting a conference call today at 10:00am (cst) to discuss their views on ene shares with clients. should you wish to listen, dial-in details are included in their report which is included below as an attachment. should you have any questions, please let me know. regards. david t. leboe director, investor relations enron corp. office 713.853.4785 cell 713.562.2160 fax 713.646.3002 pager 877.237.7732 david.leboe@enron.com <mailto:david.leboe@enron.com> jacques, glad to hear their attorney contacted you', '. if you look at ene on a price to earnings after non-recurring items for 2001 it looks far less attractive at 22.9 times. if you take ene is earnings after ""non-recurring"" items and slap on the industry average multiple of 15.5 times ene is share price is $8.51 (ouch). now obviously not everything in the non-recurring events are actually recurring but there is talk of some wholesale losses being buried in the ""non-recurring"" loss. ene is long-term debt to equity is 0.9 times but if you include all the off balance sheet leverage and the leverage inherent in our trading business the true number is significantly higher than 0.9 times. on a positive note the ene is debt is trading higher today (price not yield). here is a spreadsheet from bloomberg with the s&p pipelines sub sector p/es, and p/bs. and dividend per share (ene is is 4%, nothing like a share price falling by 85% to get that div yield up)']","$68","5","5","3","5","5","0","6","-"
"On what date did Judy Hernandez email Amber Ebow at 3:27 PM as indicated in the documents?","The document indicates that Judy Hernandez emailed Amber Ebow on February 11, 2000, at 3:27 PM.","['. matt. 5:13-15. we should be bringing peace to our jobs and not be the cause of confusion. we should be the ones= =20 to bring our gifts & talents to the table to help in whatever area god has chosen for us to work in. col.3:23-24 ""whatever you= =20 do, work at it with all your heart, as working for the lord, not for men, = =20 since you know that you will receive an inheritance from the lord as a=20 reward. it is the lord christ you are serving. > > > ""and still i rise!"" > judy hernandez on 02/11/2000 03:59:57 pm amber ebow 02/11/2000 03:27 pm julissa marron@enron 02/11/2000 03:21 pm - att00032.jpg amber ebow 02/11/2000 03:27 pm julissa marron@enron 02/11/2000 03:21 pm - att00032.jpg amber ebow 02/11/2000 03:27 pm julissa marron@enron 02/11/2000 03:21 pm - att00032.jpg good morning judy. how are you this morning. attached is the e-mail which i had sent to barb at her home which you saw there. enjoy it. have a wonderful day today. love coco received: from worldsecure ([10.4.218.42]) by mail.llgm', '. <a href=""www.ggwo.org"">www.ggwo.org</a> _____________________________________________________________ ~ please note ~ ====================================================== under bill s.1618 title iii passed by the 105th u.s. congress this letter can not be considered spam as long as we include: contact information and a remove disclosure. to un-subscribe : send e-mail to un2hisword@aol.com in the subject line, type in the phrase : please remove ! all requests to be removed via email will be honored immediately! we apologize if this daily devotional ""faith thoughts"" has not been of interest to you. ======================================================== _____________________________________________________________ judy hernandez on 02/03/2000 11:24:24 am sent by: andrea r guillen margaret smith <margaret_smith@anadarko.com> on 01/19/2000 10:40:58 am > >> from a woman who works in a police department: > >> > >> > >> i have to share some things i have learned in my job > >> with you', '.net give the page time to load.....takes a little while > <a href=""http://www.tonner.org/butterflies.html"">click here: butterflies</a> amber limas 02/02/2000 05:48 pm amber ebow 02/02/2000 04:31 pm lisa berg 02/02/2000 04:18 pm > <<part.001>> <<xywrite iii plus 4.0>> > - part.001 - blueman.jpg judy hernandez on 01/26/2000 12:14:08 pm lisa shoemake 01/26/2000 09:40 am cheryl slone 01/25/2000 03:07 pm > does heaven have a phone number? > mommy went to heaven, but i need her here today, my tummy hurts and i fell > down, i need her right away, operator can you tell me how to find her in > this book? > > is heaven in the yellow part, i do not know where to look. > i think my daddy needs her too, at night i hear him cry. > i hear him call her name sometimes, but i really do not know why. > maybe if i call her, she will hurry home to me. > is heaven very far away, is it across the sea? > she is been gone a long, long time she needs to come home now! > i really need to reach her, but i simply do not know how', '. let is continue to pray for one another. prayer:: may today there be peace within you. may you trust god that you are exactly where you are meant to be. may you not forget the infinite possibilities that are born of faith. may you use those gifts that you have received, and pass on the love that has been given to you. may you be content knowing that you are a child of god. let his presence settle into your bones, and allow your soul the freedom to sing, dance, and to bask in the sun. it is there for each and every one of you amen send this to (7) or more people and witness the awesome power of prayer. judy hernandez on 02/01/2000 02:46:47 pm this is sooooo very true. judy hernandez on 01/25/2000 01:25:08 pm jessica anaya 01/25/2000 08:47 am helen martinez <helenmar1980@yahoo.com> on 01/24/2000 09:01:56 pm note: forwarded message attached. __________________________________________________ do you yahoo!? talk to your friends online with yahoo! messenger. http://im.yahoo', "". give each of them discernment to recognize the demonic forces around them, and reveal to them the power they have in you to defeat it. i ask you to do these things in jesus' name. in christian love, your friend in jesus. passing this on to anyone you consider a friend will bless you both. passing this on to one not considered a friend is something i know christ would do. __________________________________________________ do you yahoo!? talk to your friends online with yahoo! messenger. http://im.yahoo.com this is sooooo very true. judy hernandez on 01/25/2000 01:25:08 pm jessica anaya 01/25/2000 08:47 am helen martinez <helenmar1980@yahoo.com> on 01/24/2000 09:01:56 pm note: forwarded message attached. __________________________________________________ do you yahoo!? talk to your friends online with yahoo! messenger. http://im.yahoo.com ______________________________________________________ get your private, free email at http://www.hotmail""]","02/11/2000","1","5","5","1","1","0","7","-"
"Who are the specific individuals responsible for making changes to the allocation of SAP costs for each company within ETS?","Based on the provided information, the specific individuals responsible for making changes to the allocation of SAP costs for each company within ETS include:

1. **Tracy**: Tracy seems to be a key individual involved in overseeing and approving changes related to the allocation of SAP costs, as evidenced by the communication and discussions in the emails.

2. **Mary**: Mary is involved in the process of managing and providing information related to cost allocations, as indicated by her request for information and coordination with others.

3. **Kem Miller**: Kem Miller from Enron Integrated Solutions Center is responsible for communicating changes related to SAP employee expense accounts and ensuring that personnel are aware of these changes.

4. **Chris Schlaudraff**: Chris Schlaudraff provided statistics and data used for the allocation, indicating his role in supplying necessary information for the allocation process.

Additionally, there are mentions of other individuals such as **Fred** and **Ben Humann** who may be involved in specific aspects of the process, such as resource allocation and implementation of models, but their roles are less directly tied to the overall SAP cost allocation changes.

These individuals collectively coordinate and facilitate the allocation of SAP costs within ETS, utilizing data and methodologies such as the ISC allocation metrics and business unit statistics.","['. this involves conducting investigations, setting policies and procedures and working with appropriate security elements within the business units. the group also coordinates and facilitates enron is crisis response efforts. finally, it provides business intelligence on selected issues to senior management. elizabeth, in the corp. allocations there are 410,000 dollars budgeted to ets for cc 100883. mr. horton has an agreement that none of the costs from this cc shall be assessed to any of the pipes in ets. please have these costs removed from your allocation to ets. thank you. also, can you provide me some information regarding the costs for cc 100222, gov not affairs environment and cc 140196, business controls. we are meeting with mr. horton next week and would like to provide him some explanation of the work that makes up these costs. if you could respond by tuesday, oct. 9, that would be very helpful. thank you. mary the sap costs were included in the ets overhead in adaytum', '. thanks. df please invite steve schwarzbach fyi the attached file contains the new sap employee expense accounts that have recently been extended to all companies. please forward this to personnel in your group who may need to be aware of these changes. custom reports and variants may need to be revised to include new accounts. regards kem miller enron integrated solutions center design and process support 713-345-5133 isc web: http://isc.enron.com/site isc customer care: 713-345-4727 okey with me tracy, i spoke with fred and we have a resource available to assists with the remaining ets modeling and development. dymetrix can be here this wednesday and will be dedicated to ets through the end of the year. he will be responsible for the completion of the o&m model for home office. he will also be responsible for the marketing initiative. i spoke to ben humann about omaha is resource needs. they will require a resource for two weeks starting november 12th to implement the o&m contributor model', '. how much trouble would it be to have the list of users/licenses split by ets company? we should be able to use this to allocate sap costs to companies. fyi the first workbook below (isc allocation metrics) has a password on it........ owl tracy, these are the statistics provided by chris schlaudraff. << file: isc allocation metrics.xls >> this is a recap at the business unit level. the business unit allocation is weighted as follows: 29.27% based on how many licenses we have. 53.41% based on how many documents we have on the system. 17.32% based on the amount of co data (or master data) we have on the system. << file: stats by company for ets.xls >> this is the detail of the documents (# of fi docs & # of po docs columns) and the co data (all other columns) ets has on the system.....by company. << file: isc ets licenses.xls >> this is a list of the ets users/licenses. it is not by company', '. 2. the activity is spent in support of the commercial teams identified (please let us know otherwise) 3. if the activity is using an allocation (for example ""allocate 0469"" or ""80-20 split""), that the percentage allocated to each commercial team has not changed from last month. (please let us know if it has changed what the new allocation is). in reference to these surveys, please note: if you are allocating only infrastructure costs to some commercial teams listed in the survey, please identify them. we will take your business support costs (such as feedback, training, etc.) and allocate them evenly among these teams. the costs for ""commercial team specific"" activities that you filled time out for in the january time survey will be directly allocated to that commercial team (e.g. genco support will trace 100% of its costs to genco). please let us know if you have any questions on this survey', '. attached are spreadsheets with the detail supporting the expenses for all the various services provided by enron information services. eis billings for items attached to the room, such as phones and data ports, and people specific services for contractors, such as lan id is and at&t calling cards, are billed to the same company and cost center as room rent in eb, 2ac, 3ac, or jf. for omaha, eis uses a phone database maintained by tammy anderson for this purpose. people-specific services are billed to the company and cost center corresponding to the employee is sap company and department. video conference usage, data circuits, ardmore usage, edi, and web site billings are based on a company and cost center furnished by the resource using the service. eis bills services on a one month lag. we take a snapshot of the corporate administrative services rent file for each room in eb and 3ac, of the omaha phone database for each room in omaha, and of the sap company and cost center for each employee']","Jim and Bob","1","4","3","3","1","0.01","8","-"
"Who is referred to as responsible for coordinating the setup of financial masters for trading and obtaining relevant forms and approvals in the documents?","Based on the provided information, Mark Taylor is referred to as responsible for coordinating the setup of financial masters for trading and obtaining relevant forms and approvals. This is indicated in the text where it states, ""my understanding is that responsibility for financial trading for Canada is with mark taylor."" Additionally, the text mentions that confirms requiring legal input, ISDA masters with Canadian counterparties, and structured financial transactions remain with Mark Taylor.","['. please talk it through with mark t to make sure that all works. should you and mark t talk it through with the confirm desk in canada to make sure it is clear? regards, mark haedicke sharon crawford 11/06/2000 10:17 am sent on behalf of peter keohane: please see attached e-mail from rob milnthorp. what i believe he is referring to is documentation of financial (gas or power transactions). (i.e. all physical transactions, confirms, gtc is, masters, etc. are documented out of calgary, all with the proper controls.) honestly, i am not clear on this point. my understanding is that responsibility for financial trading for canada is with mark taylor. i.e. i understand that confirms which do not require legal input have been moved to the confirm group in calgary, but confirms which require legal input, isda masters with canadian counterparties, structured financial transactions, etc. remain with mark taylor, and that calgary legal is not, generally speaking, responsible for financial transactions', '. please advise if the legal position is changing. assuming we are unable to achieve the aforementioned solution, these deals raise more significant issues regarding support and control of new business endeavors for ees which already has significant infrastructure and control issues. it raises issues to be resolved on: credit approval and monitoring credit provisions legal support in ees with financial and isda experience netting issues and additional credit risk from having multiple masters with our clients (physical and financial) execution of masters post trade execution capturing and monitoring these otc financial trades separate from financial settlements of physical trades managing portfolio position risk operational issues capturing and properly valuing the trades operational support for confirmations and ensuring timely execution in short, we need to establish processes to support this business. i will set up a meeting with relevant parties to discuss further', '. michelle bruce will assume the global products business lead role. she will be responsible for ensuring that the business processes and procedures are as effective and efficient as possible. she will also be working with other groups and offices to ensure consistency of both performance measures and business standards. john swinney, lead of risk management, and lisa walker, lead of logistics coordination, will report directly to michelle. michelle thomason will continue in her current strategic planning role. in addition, she will assume the business lead role supporting new endeavors that our will group will become involved in, including the cost of funds and prepays activity. michelle will report to michelle bruce. we are pleased to announce that jeff sorenson has joined the global products management team . he will be responsible for physical confirmations as well as coordinating the financial confirmations and financial settlements for global markets', '. we have already reviewed northern states power company, a minnesota corporation (cpy id #265). the counterparty that showed up on yesterday is list is northern states power company, a wisconsin corporation (cpy id #161). the wisconsin corporation is a sub of the minnesota corporation. i do not know if this makes any difference in your approvals... robin newman matthew bender & co. 212/448-2168 with the execution of the wisconsin gas company master, this brings the total executed financial masters to 400. the countdown to 500 executed financial masters is now starting! congratulations to the legal and credit teams for getting us to this point and for a job well done! molly harris 03/01/2000 05:55 pm please find attached credit is eol responses for 3/1/00. regards molly leslie, why am i getting this information below? these counterparties are not on my approval lists for the last few days', '. we did not know and the cat just kept on appearing in our screen. mine is saved to my desk top so i have a cat wandering around on my banner screen. - felix21.exe as far as your email questions, my responses are following: 1. the list i have provided you is the only list that exists on financial counterparties. there is no excel spreadsheet to follow. 2. duke energy corporation. at mark is direction, i am sending his note below regarding utilities. again, until we do the due diligence on a utility counterparty we have no way of knowing what kind of local, state or federal regulation or approvals they may be subject to. we currently have masters in place with only about 10 utilities/govt is. we are in the process of negotiating another 30. until those masters are executed and we have the relevant resolutions, authority documents and/or legal opinions, i cannot approve them for online trading']","Tana Jones","1","5","3","5","1","0","9","-"
"What is the date of Vince Kaminski's presentation at the University of California at Berkeley?","Based on the provided information, Vince Kaminski's presentation at the University of California at Berkeley is scheduled for September 10th. This date was chosen to coincide with the university's calendar and was deemed feasible by the recipient of the forwarded message, who indicated that they could accommodate Vince's presentation on that date.","['. >i am forwarding a message from lexi elliott with our associate/analyst >program. she suggests >that vince come to the university on september 10 or 17th so that his >presentation coincides >with their calendar. is this feasible from your stand point? sep. 10th is indeed feasible. i scheduled the invitation dates of 9/24 - 10/17 to give me time to make progress in my class presentations so that students would have more of a background in listening to vince is presentation. if select the 9/10 date, i would ask vince to take into account in the level of his presentation that by that date the students will only have had 6 hrs. of the foundations of energy finance class (classes begin 8/29 and labor day intervenes). on the plus side, the students do come in with three finance courses (core course, investments, advanced corporate) as prerequisites to my class. in sum, i appreciate the importance of recruiting and can accommodate vince is presentation sep. 10th. please advise if vince would like the 2 1/2 hr', '. vince j kaminski@ect 09/18/2000 01:26 pm steve, i am a lead recruiter at the university of california at berkeley for enron analyst/associate program. i contacted several friends who work at berkeley and received an invitation from one of them to make a presentation at the weekly faculty seminar of the dept. of industrial engineering and operations research. the students and faculty members from the business school will be also invited. berkeley in general, and department of industrial engineering and operations research in particular, are important centers of academic research on electricity markets (s. oren works very closely with severin borenstein). my presentation will focus on the analyst/associate program. i shall also have an opportunity to discuss the power markets in california (i expect many questions) before many experts who are very important to shaping public opinion and regulatory agenda', '. please let me know your thoughts. this will require d&b to give us a modified quote and we could possibly move forward quickly. regards, amitava <embedded stdolelink> alex huang@enron 04/30/2001 10:44 am fyi vince vince i will be attending the alp presentation on may 7 and would be pleased to join the team for dinner if it is not too late. thank you dennis loughridge dennis w. loughridge director of energy consortium rice university 713-348-2812 sorry, trying again. i probably got a wrong e-mail address and the original message was returned. vince kaminski vince j kaminski 04/10/2001 08:13 am on behalf of enron corp. i would like to invite you to an alp project presentation by a group of students of jesse h. jones graduate school of management, rice university. the students will present the results of a research project regarding electronic trading platforms in the energy industry. the presentation will be held on may 7, at 4:00 p.m. at enron, 1400 smith', '. thanks vince j kaminski@ect 09/18/2000 01:26 pm steve, i am a lead recruiter at the university of california at berkeley for enron analyst/associate program. i contacted several friends who work at berkeley and received an invitation from one of them to make a presentation at the weekly faculty seminar of the dept. of industrial engineering and operations research. the students and faculty members from the business school will be also invited. berkeley in general, and department of industrial engineering and operations research in particular, are important centers of academic research on electricity markets (s. oren works very closely with severin borenstein). my presentation will focus on the analyst/associate program. i shall also have an opportunity to discuss the power markets in california (i expect many questions) before many experts who are very important to shaping public opinion and regulatory agenda', '. eliz-- keep vince on the distribution list for the documents we are generating now to repond to the california situation. vince j kaminski@ect 09/18/2000 01:26 pm steve, i am a lead recruiter at the university of california at berkeley for enron analyst/associate program. i contacted several friends who work at berkeley and received an invitation from one of them to make a presentation at the weekly faculty seminar of the dept. of industrial engineering and operations research. the students and faculty members from the business school will be also invited. berkeley in general, and department of industrial engineering and operations research in particular, are important centers of academic research on electricity markets (s. oren works very closely with severin borenstein). my presentation will focus on the analyst/associate program']","October 23rd","1","3","3","3","3","0","10","-"
"What follow-up action does Vince Kaminski suggest regarding the Japanese translation of his book 'Managing Energy Price Risk'?","Vince Kaminski suggests that Masayuki Fujita should discuss the Japanese translation issues with the contact at Risk Magazine. He mentions that he has talked to Risk Magazine and that they will be contacting Fujita shortly to address these issues. Kaminski also indicates that the copyright for the book belongs to Risk Magazine, and he will provide the contact information for further discussions.","['. he forwarded it to george wasaff who is responsible for ""e-procurement"". jens dear mr. fujita: thank you for you interest in enron. i shall be honored if you visit enron and i shall invite other employees of the company to the meeting. please, call my assistant, shirley crenshaw (713 853 5290) to discuss the exact time of your visit. she will be trying to reach you from our end. the copy right for the book belongs to the risk magazine. i shall give you the contact at the company with whom you can discuss the japanese version issues. sincerely, vince kaminski masayuki fujita <mfujita@mri.co.jp> on 03/31/2000 08:36:00 am professor vincent kaminski vice president of research enron corp. dear professor kaminski i , masayuki fujita was the only japanese attendee of the energy derivatives seminar in houston last december and a member of japanese consultation firm: mitsubishi research institute, inc. i would be very honored if you can meet with me 17 or 18 april after attending energy trading summit in 12th-14th', '. currently, the relationships with many leading academic centers depend on personal commitment of a number of overworked enron employees. in many cases, there is no continuity and focus. i want to recommend a creation of a special function (vp or md level) responsible for coordinating our relationships with the universities. this function would be separate from our analyst/associate program. i have many ideas how this function could be structured. vince dear mr. fujita, thank you very much for the pictures. i have talked to risk and they will be contacting you shortly. vince kaminski fyi vince masayuki fujita <mfujita@mri.co.jp> on 05/31/2000 10:17:07 am dear professor kaminski, it was a great opportunity to meet with you and mr. masson. enclosed are digital pictures at latour d\'argent. thanks again for your kind hospitality. we have translated almost a half of the book ""managing energy price risk"". we are now finding a publisher of japanese book and want to know the contact in risk publications', '. vince kaminski i wanted to pass along our latest research note to you. the topic is the new agency futures contracts. open the .pdf file to read it. the .xls file contains the daily report that we will be releasing on our web page that will enable the user to analyze the basis for richness-cheapness of the contracts or to create the dv01s to figure hedge ratios. (see attached file: agencyfutures.pdf)(see attached file: agencyprint.xls) - agencyfutures.pdf - agencyprint.xls fyi vince masayuki fujita <mfujita@mri.co.jp> on 03/31/2000 08:36:00 am professor vincent kaminski vice president of research enron corp. dear professor kaminski i , masayuki fujita was the only japanese attendee of the energy derivatives seminar in houston last december and a member of japanese consultation firm: mitsubishi research institute, inc. i would be very honored if you can meet with me 17 or 18 april after attending energy trading summit in 12th-14th', '. he is the best expert on california right now. vince -----original message----- [mailto:imceanotes-+22philip+20annesley+22+20+3cpannesley+40riskwaters+2ecom +3e+40enron@enron.com] sent: wednesday, may 30, 2001 7:50 pm vince thanks for coming back to me on this anyway. would you be able to suggest anyone else - either in australia, europe or us who would be good to get to discuss the california crisis? kind regards. philip -----original message----- philip, i have to decline the invitation with regrets. i have too many commitments right now. vince kaminski -----original message----- [mailto:imceanotes-+22philip+20annesley+22+20+3cpannesley+40riskwaters+2ecom +3e+40enron@enron.com] sent: monday, may 28, 2001 3:27 am dear vince just a quick message to follow up on the email that i sent you recently inviting you to speak at our forthcoming congress, risk 2001 australia, which is taking place in sydney on 20 & 21 august 2001', '. a key part of our publishing strategy is to present our titles as a seamless whole, with global sales, marketing and distribution. our various sales channels include teams dedicated to servicing the needs of the booktrade; online accounts; corporates; libraries, universities and the increasing number of e-content providers (e.g. netlibrary; fat brain etc.) topics of interest that initially spring to mind include: managing metals price risk managing energy price risk weather risk management books on trading, risk management etc. for specific commodities (broadband; electricity, natural gas, oil etc.) when we met you discussed the possibility of putting together a book proposal on metals, with your team at enron. i very much hope that you decide to pursue this further. for your information, i have attached our standard new book proposal form below, as a guideline. finally, you also planned on speaking with vince kaminski about other publishing opportunities and book ideas']","Contact RISK magazine.","2","5","3","3","3","0.1","11","-"
"What is the best resolution considered to address the issue of old unrecovered cash calls with Reliance and ONGC discussed in the documents?","The best resolution considered to address the issue of old unrecovered cash calls with Reliance and ONGC, as discussed in the documents, is to file an arbitration proceeding. This decision was made to involve an objective third party to settle the issue after other means of resolution were exhausted. The arbitration notices were finalized, dated on July 29th, and delivered on July 31, 2000.","['i was in india last week meeting with partners and we all agreed that the best thing to do to move ahead regarding the old unrecovered cash calls (""joint interest billings"") was to file an arbitration proceeding and get an objective third party to settle the issue. as you know, reliance and ongc owe eogil approximately $7.1 and $10.3 million, respectively (including interest on non-payment). the arbitration notices reflected only the non-payment numbers which are $5.8 and $7.3 million for ril and ongc respectively. we finalized the drafting and dated the notices on july 29th and we delivered the official notice during business hours monday july 31, 2000. this was the final step in a very long effort to resolve this issue in other means, but as i noted to the ooc after the june meetings this was the only solution in the end', '. 2, have you seen jewel meeks, she is lost a ton of weight and looks like her old self again. you are welcome my friend............i am glad to know you are still checking your e:mails. (smile) you are the best, thanks otha.....i mean ora!!!!!!!!!!!!!!!! good afternoon ms. thurston. attached is the job posting per our conversation. have a groovy hip one. (smile) sr service specialist essential functions: overall implementation and contract compliance accountability. responsible for deal profitability validation and reporting. bill payment, invoicing and reporting validation and issue resolution. drive internal and external communications to ensure customer satisfaction and customer referenceability. essential requirements: bachelor is degree and three years experience in industry-related field. individual must be detail-oriented with ability to synthesize information from a number of sources. ability to handle multiple projects simultaneously', '. regards mrp great work again from your team! thanks. --sally fyi. jr jr i am happy to say everything is going well, we are on track, all pc is in place and powered, fault resolution in progress. we had a small issue with the power 24hr phones, all inbound calls were intercepted at portland on the rollover group, the issue was rectified and all is working as designed i will keep you updated as we progress martin bucknell from our work weekend before last, our third scenario (staying in the business, but making improvements more slowly and reducing some service levels), our estimated savings for operations and it development were: annualized savings (in millions) & headcount reductions (enron employees) direct costs bonus subtotal net cap total ops it accural savings severance savings ex savings 5.4 12.8 1.5 19.7 3.8 15.9 11.8 27.7 dollar savings 65 71 - 136 fte reduction this work was not done at the level of identifying individuals, but rather positions', '. since i know you would like an immediate fix to your tva control area issue, during the month of august you might pursue tva is policy actions against our control area in violation of federal statute. (in the meantime, however, i am continuing to work the appropriations strategy (best possible resolution date october 1, 1999) and the authorization strategy (best possible resolution date october 7, 2000.)) currently, the tva inspector general george prosser who can be reached at (423) 632-4120 is in hot pursuit of mr. crowell. he has successfully had legislation introduced to curb mr. crowell is authorities, and soon will issue a report (sure to receive much front page negative publicity) that mr. crowell ""lied"" to congress by failing to disclose a tva $100,000 monthly publicity retainer with hill & knowlton to a house congressional oversight committee. ironically, this retainer was to help mr. crowell obtain favourable earned media. we believe the i.g', '.com. if you have any questions, please contact us at noc@paulhastings.com. ============================================================================== ""the information transmitted is intended only for the person or entity to which it is addressed and may contain confidential and/or privileged material. any review, retransmission, dissemination or other use of, or taking of any action in reliance upon, this information by persons or entities other than the intended recipient is prohibited. if you received this in error, please contact the sender and delete the material from all computers."" ============================================================================== here is a revised change order which we hope will adequately address issues raised by ge and by northwestern. kay hi warren, please print all of these documents, and place in individual file folders with the name of the document. i will need 6 copies of each of the signature pages for each of the documents']","Arbitration proceeding","1","4","3","1","5","0.07","12","-"
"Who is set to lead the Office of the Chairman in the newly formed Enron Energy Services?","The Office of the Chairman in the newly formed Enron Energy Services (EES) is set to be led by Lou Pai, who will continue as Chairman, and Tom White, who will continue as Vice Chairman.","['. mark muller, president and ceo will lead this group. all four new business leaders will report directly to ees=01, office of the= =20 chairman, lou pai, who will continue as chairman, and tom white, who will= =20 continue as vice chairman. in addition, kevin hughes, vice president and= =20 chief accounting officer, vicki sharp, managing director and general counse= l,=20 and beth tilney, managing director of marketing, hr and customer satisfacti= on=20 will continue to report to the office of the chairman. please join us in congratulating these individuals. i think this is an excellent letter. i agree with sue is comments and have included her changes on page 3. all changes have been marked in this version. enron also announced today a restructuring of its broadband business. conditions in the broadband industry have reduced revenue opportunities in the sector', '. these folks would continue to work on esa is projects but would get the resources and support of the centralized body particularily in their negotiations with outside vendors including nepco and oec. it would also be another linkage into the samerican business from houston to help monitor and defray technical and development risk. lets see if kishkill and redmond get to the right answer. regards delainey steve, i only have the following suggestion for the office of the chairman paragraph: ""dave is forming an office of the chairman in ees. joining dave, in the office of the chairman, will be marty sunde, as president, global marketing services and dan leff, as president, global energy services. dan and marty have been instrumental in the development and execution of the successful ees business model. in addition, janet dietrich will join the office of the chairman as chief operating officer', "". this review process will take time as it will require approval of the creditors' committee. we will update you periodically on our process. personnel matters as a result of our current situation, we have made many personnel changes over the past several months to maximize the value of the organization. office of the chairman - enron corp jeff mcmahon, executive vice president and chief financial officer, has been added to the office of the chairman of enron corp along with ken lay and greg whalley. among other things, jeff has been working on the business plan for reorganization in chapter 11 and is the primary contact with the newly formed creditor is committee. treasurer - enron corp ray bowen was elected to executive vice president, finance and treasurer of enron corp recently. in this role, ray is responsible for all finance activities of enron corp. ray also has the lead role in managing the cash activities of the company on a day to day basis"", '. ewa will have a real first class operation. uh-huh. jwvs =09kay mann@enron =0903/19/2001 07:12 am =09=09=20 hi john, sounds like we are now reunited in the same legal group, ews. true? =20 kay sent by: enron announcements in order to better align our engineering and operations capabilities with t= he=20 commercial businesses they support, we are pleased to announce the followin= g=20 organizational change will be effective immediately. a new business unit,= =20 enron engineering and operational services (eeos), is being formed which wi= ll=20 include our existing operations in enron engineering and construction compa= ny=20 (ee&cc), operational energy corporation (oec), and national energy producti= on=20 corporation (nepco). brian stanley, as president and chief executive officer, and keith dodson, = as=20 chief operating officer will provide the leadership for this new=20 organization, reporting to the office of the chairman of enron wholesale=20 services', '. a new business unit,= =20 enron engineering and operational services (eeos), is being formed which wi= ll=20 include our existing operations in enron engineering and construction compa= ny=20 (ee&cc), operational energy corporation (oec), and national energy producti= on=20 corporation (nepco). brian stanley, as president and chief executive officer, and keith dodson, = as=20 chief operating officer will provide the leadership for this new=20 organization, reporting to the office of the chairman of enron wholesale=20 services. nepco will continue to operate as a stand-alone business under= =20 john gillis, president. with the majority of ee&cc and oec=01,s activities focused on assets and=20 projects which are in wholesale services, this will better align the effort= s=20 of eeos with the commercial businesses it supports. while eeos will be a= =20 stand-alone unit within enron wholesale services it will work very closely= =20 with and have direct accountability to the business units it supports']","Dave Delainey","1","1","3","1","1","0","13","-"
"Who should you contact if you need assistance with your Outlook migration at Enron?","If you need assistance with your Outlook migration at Enron, you should contact the Outlook 2000 question and answer mailbox at outlook.2000@enron.com. Alternatively, you can also reach out to the resolution center at 713-853-1411 for support.","["". i will be coming back friday with lots of fish!!!!!!!! before i forget here is my cell phone number 303-667-3495. i hope it works there. do you still have one? i will pick up my luggage and be at the passenger pick-up. if you have a cell phone i can call you whether it is my cell phone or from a pay phone. see you friday! mary germany, manager accounts payable payroll accounting support (303) 713-2151 fax (303) 846-2151 email - mgermany@ch2m.com outlook migration team@enron 04/30/2001 02:44 pm current notes user:=20 to ensure that you experience a successful migration from notes to outlook,= it is necessary to gather individual user information prior to your date o= f migration. please take a few minutes to completely fill out the followin= g survey. when you finish, simply click on the  areply' button then hit  ise= nd' your survey will automatically be sent to the outlook 2000 migration m= ailbox. thank you"", '.com carol st. clair eb 3889 713-853-3989 (phone) 713-646-3393 (fax) carol.st.clair@enron.com outlook migration team@enron 06/07/2001 11:04 am current notes user: to ensure that you experience a successful migration from notes to outlook, it is necessary to gather individual user information prior to your date of migration. please take a few minutes to completely fill out the following survey. double click on document to put it in ""edit"" mode. when you finish, simply click on the  areply with history\' button then hit  isend\' your survey will automatically be sent to the outlook 2000 migration mailbox. thank you. outlook 2000 migration team full name: carol l. st', '. you will not be able to do many of the things in owa that you can do in outlook. below is a brief list of *some* of the functions not available via owa: features not available using owa: - tasks - journal - spell checker - offline use - printing templates - reminders - timed delivery - expiration - outlook rules - voting, message flags and message recall - sharing contacts with others - task delegation - direct resource booking - personal distribution lists questions or concerns? if you have questions or concerns using the owa client, please contact the outlook 2000 question and answer mailbox at: outlook.2000@enron.com otherwise, you may contact the resolution center at: 713-853-1411 thank you, outlook 2000 migration team outlook migration team@enron 04/27/2001 01:00 pm current notes user: to ensure that you experience a successful migration from notes to outlook, it is necessary to gather individual user information prior to your date of migration', "".2000@enron.com otherwise, you may contact the resolution center at: 713-853-1411 thank you, outlook 2000 migration team outlook migration team@enron 04/30/2001 09:02 pm current notes user: to ensure that you experience a successful migration from notes to outlook, it is necessary to gather individual user information prior to your date of migration. please take a few minutes to completely fill out the following survey. when you finish, simply click on the  areply' button then hit  isend' your survey will automatically be sent to the outlook 2000 migration mailbox. thank you"", '. you will not be able to do many of the thin= gs in owa that you can do in outlook. below is a brief list of *some* of t= he functions not available via owa: features not available using owa: - tasks - journal - spell checker - offline use - printing templates - reminders - timed delivery - expiration - outlook rules - voting, message flags and message recall - sharing contacts with others - task delegation - direct resource booking - personal distribution lists questions or concerns? if you have questions or concerns using the owa client, please contact the = outlook 2000 question and answer mailbox at: =09outlook.2000@enron.com otherwise, you may contact the resolution center at: =09713-853-1411 thank you, outlook 2000 migration team outlook migration team@enron 04/27/2001 01:00 pm current notes user:=20 to ensure that you experience a successful migration from notes to outlook,= it is necessary to gather individual user information prior to your date o= f migration']","Outlook 2000 Migration Team","1","4","3","3","3","0.16","14","-"
"Who from Enron requested flexibility on the payment of the September 30 principal payment for Panther, and why?","The request for flexibility on the payment of the September 30 principal payment for Panther was communicated by an unnamed representative of Enron. The reason for the request was due to the restructuring of the Panther loan, which became necessary after Panther violated certain financial covenants because of a temporary shutdown of coal production at the mine. Despite these covenant violations, all principal and interest payments had been made as scheduled. The representative mentioned that deferring certain principal payments until June 30, 2000, when Panther was expected to resume coal production, was part of the restructuring considerations. Additionally, DPR Holding Company, which was holding $2.0 million for the payment or dividend distributions, requested to wait until the distribution payment date in November to make the principal payment. This would provide more time to finalize the restructuring negotiations and potentially defer the payment until June, allowing DPR to make a larger dividend distribution to both Enron and Chris Cline. The representative clarified that agreeing to this delay did not constitute a waiver or decision to defer the payment.","['. our next meeting will be next wednesday, november 1 in eb38c2. thanks again for the hard work. mark senior counsel, ena phone: 713-345-8897 facsimile: 713-646-3940 e-mail: mark.greenberg@enron.com alan, please confirm that you have told mike that it is required that legal be consulted on such a waiver. mark this memo is being sent to inform you that the september 30 panther principal payment was made today and to clarify the confusion around the delay for the payment. panther is one of the operating subsidiaries in our dpr holding company relationship with chris cline. as many of you are aware, we are in the process of restructuring the panther loan. panther has violated certain financial covenants as a result of the lack of coal production when the mine was temporarily idled. these covenant violations put the loan in default and put us in a position to restructure certain aspects of the relationship. (all principal and interest payments have been made as scheduled despite the shutdown)', "". fred and his customer, while i was listening on a taped line, agreed to structure settlement of trade ny9319 as such: amounts to be paid; $483,000 premium payment owed and due $192,375 amount ena owes this customer for sept financial settlement - being withheld and netted against the $483m $290,625 net amount to be financed until final payment is made on september 30. $1,353 amount of interest on the principal, using interest rate of 10%, 17 days of tenor $291,978 exact amount to be paid on september 30 please structure the above referenced terms into appropriate language for the confirmation of trade ny9319 and provide such language to the confirmation desk. original deal done march 3, 2000: nb4261 ena long call 28.30 1,000/bbls/d oct-dec'00 ena short put 22.50 1,000/bbls/d oct-dec'00 ena long put 18.50 1,000/bbls/d oct-dec'00 new deal done september 11, 2000: ny9319 customer long call 28.30 1,000/bbls/d oct-dec'00 customer short put 22.50 1,000/bbls/d oct-dec'00 customer long put 18"", '. we communicated with law enforcement officials who found the threat unsubstantiated and without merit. nonetheless we take all threats seriously and have increased the security presence at the enron center still further. we just refinanced this past monday. we were going to do a 15 year at 6%, but changed our minds and decided to do the 30 year again, but could only get 6-5/8% (still much better than the 8% we had before). we are still going to pay on it like a 15 year mortgage, but the 30 years gives us flexibility to make the lower payment in case of an emergency. 5.75% sounds really good -- do you have to pay points to get it that low? i like 15 year loans for the interest rate, but like 30 year loans for the flexibility -- it is really a matter of personal choice. that is why we went with the 30 year and will pay like a 15 -- it costs a little more (due to int rate) than a straight 15 year mortgage, but is kind of an insurance policy because you only have to pay the small 30 year payment', '. (all principal and interest payments have been made as scheduled despite the shutdown). part of the restructuring may involve deferring certain principal payments until 6/30/00 when panther is expected to resume coal production. since we are in the process of negotiating certain changes and since dpr holding company was sitting on $2.0 mm to be used for the payment and/or dividend distributions, they asked if they could wait until the distribution payment date in november before making the principal payment. this would give us a few more weeks to finalize the restructuring negotiations and perhaps enable them to defer the payment until june. this would also allow dpr to make a larger dividend distribution to both us and cline. i told them that this was okay but that it did not constitute a waiver or decision to defer the payment. unfortunately, this was not communicated well internally', '.netscape.com. - letter to jim taylor-enron attorneys-10-12-99.doc please disregard to prior version and use this one. tyrell, i am assuming that cannon has not signed the amendment to the letter agreement yet and we can just modify that letter. let me know and i will modify the amendment letter to reflect the new payment date. barry tycholiz@enron 04/21/2001 10:03 am yes, we can make that payment for any date. let is raise a letter amending the payment from 30 days to whatever date he wants. bt attached are the two confirms for the sierra pacific power gas deal with the netting language inserted in the confirms as requested by credit. please review and let me know if you have any questions. christian yoder in portland also reviewed the language. for the sake of completeness attached is the final version of the gas transaction support agreement. ""meier, peter"" <peter.meier@neg.pge']","Chris Cline; they requested flexibility to finalize the restructuring negotiations and possibly defer the payment until June.","2","1","1","3","5","0.15","15","-"
"Where and when is the Energy in Europe Congress 2000 taking place?","The Energy in Europe Congress 2000 is taking place at the Kempinski Hotel in Berlin from 19th June to 22nd June 2000.","['. have our ph. #  is with you just in case you get lost. (home: 281-240-5705, cell: 713-433-3158) there are copies of directions at shirley is desk. krishna. tanuja tulsiani <ttulsi@iirltd.co.uk> on 03/30/2000 04:39:22 am dear energy in europe congress delegate energy in europe congress 2000 19th june * 22th june 2000 * kempinski hotel , berlin i am delighted that you will be joining us to speak at our energy in europe2000 conference (formally known as electricity in europe congress) and enclose copies of the printed brochure for you and your colleagues. i hope that you will agree that the programme looks excellent and the response so far indicates that the event will be extremely well attended. i would be grateful if you could just take a moment to look through the items we would like from you prior to the conference to help ensure everything runs smoothly on the day', '. opinions, conclusions and other information in this message that do not relate to the official business of my firm shall be understood as neither given nor endorsed by it. - alex.doc tanuja tulsiani <ttulsi@iirltd.co.uk> on 03/30/2000 04:39:22 am dear energy in europe congress delegate energy in europe congress 2000 19th june * 22th june 2000 * kempinski hotel , berlin i am delighted that you will be joining us to speak at our energy in europe2000 conference (formally known as electricity in europe congress) and enclose copies of the printed brochure for you and your colleagues. i hope that you will agree that the programme looks excellent and the response so far indicates that the event will be extremely well attended. i would be grateful if you could just take a moment to look through the items we would like from you prior to the conference to help ensure everything runs smoothly on the day', '. regards, sherri sera assistant to jeff skilling 713.853.5984 713.646.8381 fax i am sure you are aware that as part of first ever risk awards - published in january - enron corporation achieved the accolade: energy/commodity derivatives house of the year. this award was won, not simply because of your lead in energy and power in the us, but because of the lead enron has taken in new areas of risk management. we very much hope you can join us to be presented with the award at the risk 2000 europe congress in paris on april 11th - we invite you to attend the conference as a full delegate and i am sure there are a number of sessions which will be of interest to you. a formal invitation will follow from our editor. we also intend to publish a special supplement that will provide awards winners with an excellent opportunity to celebrate their achievements through advertising. this supplement will be distributed with the march issue of risk and to all delegates attending the risk 2000 congress', "". ? if you are unable to make this deadline, please could you inform us as soon as possible so that we can make alternative arrangements and avoid printing delay. under separate cover we have arranged for five brochures to be sent to you outlining the full programme. these should arrive very shortly. should you have any queries regarding your participation at the conference please contact tanuja tulsiani, our logistics manager who will be looking after the  wouldomestic' side of the event. you can call her direct on (44) 171 915 5173 or do contact myself. thank you once again for joining us and i look forward to seeing you in the berlin. with kind regards, alexandra howells director energy in europe congress 2000 - hotel form.doc - pink form.doc - marketing.doc zimin lu 03/31/2000 01:43 pm anjam ahmad 03/28/2000 02:08 pm hi martina & trena, i think this is a reasonable smoothing method between the short and long-term models - let me know if you need me to explain it"", '.-vis the refineries and western competitors. title: european energy signpost--marching to market: the zeebrugge trade in gas author: blakey e-mail category: alert product line: european gas & power url: http://eprofile.cera.com/client/egp/alt/112399_10/egp_alt_112399_10_ab.html summary: two months into the 1999/2000 heating season in europe it is already clear that a new basis for pricing and trading gas in the continental business--the march to market--has begun. principal-to-principal gas trade at zeebrugge is taking place, with an increasing number of participants. a new ""standard contract"" and a so-called hub services agreement were launched last week, under the auspices of belgium is distrigaz. together these agreements provide mechanisms for day-ahead and within-the-day trading. title: afloat but adrift? energy markets and the undercurrent of change author: global energy team e-mail category: watch product line: global energy url: http://eprofile.cera.com/client/ge/wch/110399_11/ge_wch_110399_11_ab']","Kempinski Hotel, Berlin, June 19-22, 2000","5","3","4","1","5","0.38","16","-"
"What is the key responsibility of the VP PRC in Enron's new committee structure?","The key responsibility of the VP PRC (Vice President Performance Review Committee) in Enron's new committee structure is to evaluate the performance of Enron's vice presidents, determine promotions to the vice president level, and recommend promotions to managing director. Additionally, the VP PRC is responsible for reviewing and proposing changes to the PRC process, performance evaluation criteria, and promotion criteria.","['. we urge you to serve if at all=20 possible, but, if you cannot, please contact the committee chair. vp prc the vp prc will continue to be responsible for evaluating the performance o= f=20 enron=01,s vice presidents, determining promotions to vice president, and= =20 recommending promotions to managing director. additionally, the vp prc wil= l=20 review and propose changes to the prc process, the performance evaluation= =20 criteria and the promotion criteria. the vp prc will be chaired by dave delainey and its membership is as follow= s: tim belden=09ben glisan=09danny mccarty michael brown=09joe gold=09jeff mcmahon rick buy=09mark haedicke=09rob milnthorp wes colwell=09jim hughes=09matthew scrimshaw david cox=09louise kitchen=09jeff shankman janet dietrich=09michael kopper=09richard shapiro dave duran=09john lavorato=09marty sunde jim fallon=09dan leff=09 analyst/associate prc the analyst/associate prc will be divided into 3 groups', '. not everyone= =20 listed has been contacted in advance. we urge you to serve if at all=20 possible, but, if you cannot, please contact the committee chair. vp prc the vp prc will continue to be responsible for evaluating the performance o= f=20 enron=01,s vice presidents, determining promotions to vice president, and= =20 recommending promotions to managing director. additionally, the vp prc wil= l=20 review and propose changes to the prc process, the performance evaluation= =20 criteria and the promotion criteria. the vp prc will be chaired by dave delainey and its membership is as follow= s: tim belden=09ben glisan=09danny mccarty michael brown=09joe gold=09jeff mcmahon rick buy=09mark haedicke=09rob milnthorp wes colwell=09jim hughes=09matthew scrimshaw david cox=09louise kitchen=09jeff shankman janet dietrich=09michael kopper=09richard shapiro dave duran=09john lavorato=09marty sunde jim fallon=09dan leff=09 analyst/associate prc the analyst/associate prc will be divided into 3 groups', '. please= =20 mark your calendars for the following super saturday weekends and=01(. save these dates october 28-29, 2000 november 3-4, 2000 november 10-11, 2000 november 17-18, 2000 december 1-2, 2000 december 9-10, 2000 oxley and i will come up with a first stab at the option grants. john i guess we were wrong. we were totally surprised by the a.g.a. number. we need to work on are ability to predict it. therefore, we probably net sold contracts today and will be under our 40 million limit. i do not think there is any reason to change what we did today. we will keep it in our pocket for 10 days unless you disagree. john now i have three places to be on december 1st. super saturday, portland christmas party and brazil. i working on the cloning process. mr. lavorato, as a member of the vp prc committee you have been selected to attend esa bu prc meeting on december 1, 2000 in sao paulo. you will be responsible for attending and participating in the vp pre-ranking portion of this meeting', '. thank you i need you to leave me alone for a week. john, what do you need from us to get these done? our hr records indicate you have not completed year end 2000 performance reviews for the following employees at the vp/md and assistant levels: john arnold tim belden fred lagrasta scott neal kevin presto hunter shively scott tholan kim hillis colleen sullivan-shaklovitz phillip allen tom martin if you have completed these reviews, please forward them to me or your hr representative so our records can be updated. if not, please do so as soon as possible. if someone else is responsible for completing any of these reviews, please let me know. thank you it would be helpful to have the cases below 50. john, please, see attached mtm sensitivity for petrobr?s deal. regards, guy ishikawa andrea yowman 12/20/2000 07:14 pm in preparation for the final vp and md prc meeting, rick has identified you as a key business person to provide feedback on employees in his functional organization', '. please let us know which of these options (or a derivative therein) you would prefer. for continuity through the year-end process, we might consider having the existing md vp prc committee review the vp slate; and the former ec and two newly appointed ec members who are also vp prc committee, (john lavorato and jeff shankman were suggested), ratify the vp slate and review the md is. the newly appointed ec members who are md level will remain in the ""not rated"" category, so that jeff and john may participate in the overall discussion and depart before discussions relative to them and their ec colleagues. alternatively, we might disband the existing md vp prc committee in favor of having the newly appointed ec (13 of whom are md vp prc) review the vp slate. thereafter, the enron corporate policy committee would be responsible for ratifying these results and for reviewing the md is slate']","Evaluating the performance of Enron's Vice Presidents","2","4","4","3","5","0.17","17","-"
"What events and travels does Gerald mention participating in throughout the documents?","Based on the provided email data dump, Gerald mentions the following events and travels:

1. **Dislocating Shoulder**: Gerald mentions an incident where he dislocated his shoulder while participating in an activity. He notes that it was ""cool after I got the hang of it.""

2. **Northgate**: Gerald references someone named Will having a good time at Northgate, suggesting he might have been involved in or aware of this event.

3. **Houston Visit**: Gerald inquires if the recipient is coming into Houston anytime soon and expresses a desire to take them to dinner.

There are no other specific events or travels mentioned by Gerald in the provided text. The rest of the content mainly focuses on work-related matters and documentation.","['. it was cool after i got the hang of it, except for dislocating my shoulder. ouch! sounds like ya will had a good time at northgate. i hate it when friends take you out and get you drunk. that seems to happen to me occasionally. ok more than occasionally. this time change does make for a rough week. i did not wake up until 8:00 am for work on monday. just a little later for work than usual. coming into houston anytime soon? if you get a chance, i would really like to take you to dinner sometime. take care. bye! gerald i will revise the documents to reflect flagstaff and the items we discussed at the meeting previously. kevin is email indicates he wants to remove the language concerning a party obligations to refund the costs of the interconnect paid for by that party, if the other party is unable to maintain their pressure obligations', '. join now . ********* news from our sponsors **********free caribbean planner! order your free caribbean vacation planner, a 176-page comprehensive guide to 33 caribbean destinations. it also includes information on sights and attractions, sporting activities, food, festivals, and a calendar of events. do it caribbean! click here! fall in love with switzerland! some people say that fall is switzerland is most beautiful season. a brilliant symphony of color and senses, a masterpiece offered by nature as if it were made for an unforgettable stay. click here for more. happy travels! the travelocity.com team go virtually anywhere! www.travelocity.com unsubscribe when you registered at travelocity or preview travel, you agreed to receive e-mail. if you would like to change your subscription preferences or if you received this message in error, please click below: http://travelocity1.m0.net/m/u/tty/t2.asp?e=dgiron%40enron', '. gerald, thanks for your help on the assumption parish documents. do you know the status on the documents related to bridgeline is request for easements/rows on the crawfish land? it seems that keith daigle is the one drafting the documents. please let me know. thanks, rakhi (x3-7871) rakhi, mary ogden found and has provided eva rainer the missing documentation relevant to your item 2; i believe eva has already provided texas brine what is needed to clear up confusion relative to the various enron entity transfers that took place prior to lrci is conveyance to texas brine. as to item 1, i would ask that you work with gerald nemec of the ews legal department. he is been overseeing the napoleonville work and will be able to oversee and work with keith daigle and roger westbrook on the crawfish right-of -way work. i have recently joined the enron industrial markets legal team and am divesting of all my former gas assets and trading work. gerald can be reached at 3-3512', '. we will retain ownership of the tap/riser. steve vanhooser is out but has assigned this project to gerald nemec. by this memo i am requesting from gerald a draft facility agreement and a amendment to the interruptible transportation contract which is attached to the project agreement. joanne wagstaff@enron 07/17/2000 02:43 pm jim and j.r., the volume for exxon church of the bretheren is: 5 million/day and will increase to 20 million/day. please let me know if you have any questions. thank you! joanne x68228 attached for your review are redlines of the latest revisions to the lost creek documents based on our recent discussions. please let me know if you have any comments. looks like he punted to russell diamond. give russell a call and let him know what we need', '. that does not fit the parameters of our discussions with hanover. is ecs expected to execute the agreements with ge capital or with hanover? is the hanover agreement expected to mirror this agreement less the services that hanover is being hired to perform? ? mk > -----original message----- the contacts we discussed. gerald, here are the additional attorney names: stan springerley - rusk county electric co-op (903) 753-7474 christine ryan - north texas electric co-op (202) 342-800 john let is discuss this at our 3:15 meeting today. gerald, i have reviewed these agreements and there is no language that would indicate that oakhill would be liable for any obligations in the event of their default. please let me know your thoughts. russell more info on use of ge is form for our lease with hanover in the oakhill deal. gerald, dave gutierrez with hanover provided the following response regarding the documents he forwarded to me regarding the ge capital (operating lease)']","Going to Spain for Thanksgiving, traveling to Austin for a UT football game, attending a wedding in China, and potentially making a road trip to Austin for a game.","1","5","5","3","1","0.06","18","-"
"What is the proposal for reaching a settlement with VEPCO regarding the Real-Time hourly index published by the PJM ISO?","The proposal for reaching a settlement with VEPCO regarding the Real-Time hourly index published by the PJM ISO includes the following key points:

1. **Settlement Basis**: Enron (ENE) aims to settle against the real-time hourly index published by the PJM ISO for the Vepco/Potomac interface, with an additional $5/MWh for delivery.

2. **Flexibility in Delivery Points**: Enron would retain flexibility around the physical delivery points, meaning they can deliver the physical energy at any point identified in the contract.

3. **Call Option Preference**: VEPCO prefers to continue treating this agreement as a call option rather than a firm delivery.

4. **Index Preference**: VEPCO would prefer to settle against the day-ahead index versus the hourly index. They are also open to considering another PJM West index, such as the VAP/Alleghany index.

5. **Alternate Calling Times**: VEPCO is willing to look at alternate times for calling on power if necessary.

6. **Renegotiation Timeline**: Both parties would like to renegotiate the terms by December 1, 2001.

These points outline the framework within which Enron and VEPCO are negotiating to reach a settlement regarding the Real-Time hourly index published by the PJM ISO.","['.). enron would retain flexibility around the physical delivery points. vepco would like to continue treating this as a call option (versus a firm delivery). settlement: would prefer the day-ahead index versus the hourly index could also look at another pjm west index - vap/alleghany will look at alternate times for calling on power, if necessary would like to renegotiate by 12/01/01 << file: vepco restructure proposal 11-13-01.doc >> rahil elizabeth sager 713-853-6349 attached please find a copy of the memo from f. mitchell dutton regarding into product definition and formation of regional transmission organization for the 5:00 p.m. (est) conference call today. please contact mitch dutton at (614) 223-1605 or myself at (614) 324-6843 if you have any questions or comments. (see attached file: 87712.doc) thank you, dj stephens this e-mail message from the legal department of american electric power is for the sole use of the intended recipient(s) and may contain confidential and privileged information', '.). enron would retain flexibility around the physical delivery points. vepco would like to continue treating this as a call option (versus a firm delivery). settlement: would prefer the day-ahead index versus the hourly index could also look at another pjm west index - vap/alleghany will look at alternate times for calling on power, if necessary would like to renegotiate by 12/01/01 << file: vepco restructure proposal 11-13-01.doc >> rahil we will not be trading on thanksgiving. however, we will have a skeleton crew in here on friday. i proposed calcing p&l on wednesday and not on friday. what are the plans for thanksgiving and the friday after? as of now, it is a p&l holiday; therefore, the risks group will not be here, but eol wants to know how much support staff they should have. thanks, stacey hello everyone! please let us know if your traders are planning on trading on eol thursday the 22nd, and friday the 23rd', "".5); let is think about what we should propose (eg 150% of index hourly price per hour of non-delivery?) thanks elizabeth sager 713-853-6349 everyone, here are some follow-up items from our meeting this morning. please review them and let me know if there are any changes to this at your earliest. as discussed, we will tie-in dave and elizabeth into the meeting via phone (it starts at c. 8:00am cst). leslie reeves has confirmed that we do not have any reserves against previous years' audit. attending the meeting from vepco: kevin howell (president - energy trading). kevin was at duke prior to vepco (started with vepco on 10/01/01) karla haislip - head of origination john mable - origination jim hayes - trading goal: ene will aim to settle against the real-time hourly index published by the pjm iso for vepco/potomac interface + $5/mwh for delivery. ene will retain the option to deliver the physical energy at any point identified in the contract"", "".5); let is think about what we should propose (eg 150% of index hourly price per hour of non-delivery?) thanks elizabeth sager 713-853-6349 everyone, here are some follow-up items from our meeting this morning. please review them and let me know if there are any changes to this at your earliest. as discussed, we will tie-in dave and elizabeth into the meeting via phone (it starts at c. 8:00am cst). leslie reeves has confirmed that we do not have any reserves against previous years' audit. attending the meeting from vepco: kevin howell (president - energy trading). kevin was at duke prior to vepco (started with vepco on 10/01/01) karla haislip - head of origination john mable - origination jim hayes - trading goal: ene will aim to settle against the real-time hourly index published by the pjm iso for vepco/potomac interface + $5/mwh for delivery. ene will retain the option to deliver the physical energy at any point identified in the contract"", "".5); let is think about what we should propose (eg 150% of index hourly price per hour of non-delivery?) thanks elizabeth sager 713-853-6349 everyone, here are some follow-up items from our meeting this morning. please review them and let me know if there are any changes to this at your earliest. as discussed, we will tie-in dave and elizabeth into the meeting via phone (it starts at c. 8:00am cst). leslie reeves has confirmed that we do not have any reserves against previous years' audit. attending the meeting from vepco: kevin howell (president - energy trading). kevin was at duke prior to vepco (started with vepco on 10/01/01) karla haislip - head of origination john mable - origination jim hayes - trading goal: ene will aim to settle against the real-time hourly index published by the pjm iso for vepco/potomac interface + $5/mwh for delivery. ene will retain the option to deliver the physical energy at any point identified in the contract""]","ENE will aim to settle against the Real-Time hourly index published by the PJM ISO for VEPCO/Potomac interface + $5/MWh for delivery. ENE will retain the option to deliver the physical energy at any point identified in the contract.","3","5","3","3","5","0.29","19","-"
"For which upcoming March games is a special rate available to Enron employees?","The upcoming March games for which a special rate is available to Enron employees are:

- March 1 - L.A. Clippers
- March 3 - Golden State Warriors
- March 6 - Vancouver Grizzlies (Clyde Drexler's jersey retirement)
- March 8 - San Antonio Spurs
- March 14 - Phoenix Suns
- March 16 - Utah Jazz
- March 26 - L.A. Lakers","['. thanks again for passing the information on. i hope all is well! > here are the upcoming blazer specials for all enron employees! > > > blue section (lower level endzone) - $47 (normally $69 - available for > limited games) > > purple section (upper level center) - $20 (normally $23) > > tan section (upper level behind basket) - $10 > > > *bonus* - each ticket comes with worth of $3 blazer bucks (good for food > and > beverage in the arena) > > ** preferred seating is still available for games sold out in the general > seating ** > > to see a map with the colored sections go to http://www.blazers.com and > click on arena and tickets... > > upcoming games: > > march 1 - l.a. clippers > march 3 - golden state warriors > march 6 - vancouver grizzlies (clyde drexlers jersey retirement) > march 8 - san antonio spurs > march 14 - phoenix suns > march 16 - utah jazz > march 26 - l.a', '. i have retained the title only because i happen to be the most outspoken fan on the floor; so i love receiving all the latest news. but if you ever have a more urgent matter, or, for example, when it comes time to renew our season tickets, you will want to call mollie. she is the woman with the checkbook, so to speak. in the meantime, feel free to contact me with news about deals, discounts, free tickets, a date with the team, etc. (ha,ha) kate symes (true blazer fan contact) west power trading 503-464-7486 mollie gustafson (contact by virtue of job title) west origination 503-464-3817 ryan langan <ryan.langan@ripcity.com> on 02/16/2001 02:16:19 pm hi kate, i have been recieving quite a few calls from your employees. i hope they have been enjoying these emails. here are the games in march i am able to offer a special rate to your employees. thanks again for passing the information on', '. there have been numerous inquiries about how to secure tickets for astros games at enron field. a limited number of tickets have been allocated for enron for these inaugural games. however, we anticipate that the demand for tickets by employees will exceed this allocation. in an effort to keep all of you informed, astros tickets will be going on sale for the entire season to the general public for single-game tickets beginning this saturday, january 29th at 9:00 a.m. we recommend you secure personal tickets for the games of your choice through the traditional astros ticket outlets listed below. enron will sell a significant portion of its allotted tickets to employees in late february; however, please remember that our supply of tickets is limited and will sell out quickly. march 30 vs. new york yankees (inaugural exhibition game) march 31 vs. new york yankees april 1 vs. texas rangers april 7 vs', '. thought you guys might like to distribute the news.... here are the upcoming blazer specials for a enron na employees! > > blue section (lower level endzone) - $47 (normally $69 - available for > some games) > purple section (upper level center) - $20 (normally $23)****** > tan section (upper level behind basket - $10) > > ** call me to find out our special on preferred seats during the day of > the game! > > *bonus* - each ticket comes with a $3 blazer buck (good for food and > beverage in the arena) > > to see a map with the colored sections go to http://www.blazers.com and > click on arena and tickets... > > upcoming games: > > january 30 - chicago bulls > february 1 - phoenix suns > february 7 - seattle supersonics > february 13 - minnesota timberwolves > february 17 - boston celtics > february 20 - denver nuggets > february 22 - utah jazz > > or - call for any future blazer game!! > > for tickets please call ryan langan @ 503-797-9936 or e-mail @ > ryan.langan@ripcity', '. as you know, enron has been a leader in=20 lobbying for deregulation and a consumer=01,s right to choose energy provid= ers. for the first time in our state=01,s history, 5 percent of texas households= will=20 have this golden opportunity. the newpower company (newpower), which is=20 approximately 45 percent owned by enron, was recently formed to provide=20 energy and energy-related services to residential customers in deregulating= =20 energy markets across america, including texas. for a limited time,=20 houston-based employees will be eligible to participate in newpower=01,s pi= lot=20 program offering their deregulated electric service. be among the first to participate: enrollment with newpower begins march 12. also, watch for a special enron= =20 employees exclusive offer on your desk march 12. if you would like more=20 information about newpower, visit the company is web site at www.newpower']","The email does not specify which March games are included in the Blazers' special rates; it only states that there are upcoming specials for Enron employees.","1","1","1","5","3","0.25","20","-"
"What did Transwestern Pipeline Company request and implement in their meeting with the Laguna Pueblo environmental representative?","In their meeting with the Laguna Pueblo environmental representative, Transwestern Pipeline Company requested and implemented several actions:

1. **Closure Requests**: Transwestern committed to submitting closure requests for unresolved issues related to a UST (Underground Storage Tank) site and historic asbestos removal.
  
2. **Groundwater Remediation**: They provided a presentation explaining the challenging nature of the subsurface geology and groundwater characteristics, which complicates the rapid cleanup of contaminants such as chlorinated solvents and PCBs. They committed to continuing their remediation efforts.

3. **Endangered Species Survey**: Transwestern was required by Region IX EPA to conduct an endangered species survey of C/S 3 and 4, which they planned to complete before September 15th. This was necessary for the issuance of air permits for the Redrock turbine installation and was also a requirement for the Title V permit for the Laguna C/S.

These actions indicate Transwestern's intent to address environmental concerns proactively and comply with regulatory requirements.","['. a meeting was held with the president of del mar, concerning the issues associated with the lead in their lead acetate tape for monitoring sulfur concentrations in the natural gas. a request was made to the company to determine the feasability of recycling the tape and eleviate the management and disposal issues associated with the tape as a hazardous waste. the quarterly socal transwestern pcb conference call was held this week. transwesten is share (86%) of socal is pcb management activities was approx. $79,000. due to the press release by pg&e concerning the increased occurance of pcb is into their system, socal has initiated increased sampling activities on their system and will be proposing to do additional monitoring to track liquids from transwestern is m/s into the socal system. preliminary sampling results at strategic liquids locations on the socal system has revealed hits of pcb is in the range of 7-10 ppm, although, a hit of 77 ppm was discovered', '. the laguna is have hired an environmental person to oversee environmental issues on pueblo lands. the meeting centered around three issues: a ust site which had been removed, but not formally closed, a historic removal of asbestos which had been buried at the facility in the late 1980 is, and the ongoing groundwater remediation at the site. transwestern provided a history of the above mentioned activiites and why these issues were unresolved in the ""eyes"" of the laguna. transwestern committed to submitting closure requests for the ust and asbestos issues. with repsect to the groundwater issue, a presentation was given enlighting the laguna representative of the difficult nature of the subsurface geology and groundwater characteristics to rapidly clean the contaminants (chlorinated solvents and pcb is) and transwestern is intent to continue its remediation efforts', '. attached for your information is a copy of the comments of transwestern pipeline company on southern california gas company is november 1, 2001 advice letter 2837-a. i hope that you and all your families have a very happy thanksgiving! dan law offices of daniel w. douglass 5959 topanga canyon blvd. suite 244 woodland hills, ca 91367 tel: (818) 596-2201 fax: (818) 346-6502 douglass@energyattorney.com <mailto:douglass@energyattorney.com> linda, this looks fine. i just want to confirm that we do not countersign this transportation service request when we receive it from the potential shipper. instead, we process the request and generate a transportation agreement that we send to the shipper for execution. when we receive an executed transportation agreement from the shipper, we countersign it and begin service. is this correct? bill, teb, attached is an electronic version of the request for gas transportation form that we would like to implement for tw in the new contract system.. it is very similiar to fgt is', '. a meeting was held with the midland field teams which have title v facilities, to complete and submit the required annual certifications. all title v locations in the midland region were in compliance for this year. region ix epa has made a determination that prior to issuance of the air permits for the redrock turbine installation, transwestern is to conduct an endangered species survey of c/s is 3 and 4. a contractor has been contacted and the surveys will be completed prior to september 15th. this is not a new issue, as epa region vi, dallas required consideration of the endangered species act to be completed at the luguna c/s, which is on laguna indian lands. the title v permit will not be issued for the laguna c/s until the epa is satisified that endangered species are not a concern. preliminary environmental and right of way field data are being provided to an environmental contractor to initiate a fatal flaw analysis of a proposed project for transwestern pipeline company', '. i would appreciate it very much if each of you would revisit my memo below and then lets discuss what should be done and the approach we should take in addressing the laguna is concern about a proactive approach to reaching cleanup and closure. larry campbell 01/24/2001 10:07 am i wanted to present this summary of the meeting transwestern had with representatives of the laguna pueblo concerning the status of the pcb remediation activities by tw. on the laguna side were members of the laguna pueblo, the peop a technical oversight group that provides expertise and assistance on technical issues for all of the 19 pueblos in new mexico (ranging from ust to superfund), and members of ets ( 5 members of the laguna team, butch russell, rick smith (advisor for the laguna team), myself) and george robinson. this is the third meeting we had in the last year and a half with this group since the lagunas have started showing renewed interest in environmental activities on their pueblo']","Transwestern committed to submitting closure requests for a UST and asbestos site, and continuing groundwater remediation efforts.","3","4","3","5","3","0.21","21","-"
"What reasons did Pacific Gas and Electric Company cite for filing for Chapter 11 reorganization?","Pacific Gas and Electric Company cited several reasons for filing for Chapter 11 reorganization:

1. **Unreimbursed Energy Costs**: The company was facing increasing unreimbursed energy costs, which were growing by more than $300 million per month.
2. **CPUC Decisions**: Continuing decisions by the California Public Utilities Commission (CPUC) were economically disadvantaging the company.
3. **Ineffective Negotiations**: Negotiations with Governor Gray Davis and his representatives were not yielding any progress.
4. **Regulatory and Political Failures**: The regulatory and political processes had failed to resolve the company's financial crisis.
5. **Procurement Responsibility**: The state failed to assume the full procurement responsibility for Pacific Gas and Electric's ""net open position"" as provided under AB1X.

These reasons collectively led the company to seek the court's intervention through Chapter 11 reorganization to find a solution that the state and its regulators were unable to achieve.","['. ""we chose to file for chapter 11 reorganization affirmatively because we expect the court will provide the venue needed to reach a solution, which thus far the state and the state is regulators have been unable to achieve,"" said robert d. glynn, jr., chairman of pacific gas and electric company. ""the regulatory and political processes have failed us, and now we are turning to the court."" glynn added, ""our objective is to move through the chapter 11 reorganization process as quickly as possible, without disruption to our operations or inconvenience to our customers. throughout this crisis, our 20,000 employees have been and remain committed to providing safe and reliable service to the 13 million californians who depend on us to deliver their gas and electricity."" pacific gas and electric company decided to file for the protection of chapter 11 primarily due to: -- failure by the state to assume the full procurement responsibility for pacific gas and electric is ""net open position"" as was provided under ab1x', '."" source international brotherhood of electrical workers /contact: jim spellane of the international brotherhood of electrical workers, 202-728-6014/ duke energy statement regarding pacific gas & electric company filing for chapter 11 reorganization pr newswire 04/06/01, 4:34p (copyright , 2001, pr newswire) charlotte, n.c., april 6 /prnewswire/ -- duke energy corporation (nyse: duk) today issued the following statement: we regret that the collective actions to mitigate pacific gas & electric is (pg&e) financial crisis were unsuccessful in keeping it from filing for chapter 11 reorganization. however, the chapter 11 filing provides a defined process to collect our past receivables and keep pg&e in business going forward. duke energy had taken a number of aggressive steps to limit its financial exposure to uncertainties in california is energy market, including the potential bankruptcy of the state is investor-owned utilities', '.com> 04/06/2001 12:46 pm pacific gas and electric company files for chapter 11 reorganization business wire 04/06/01, 12:34p (copyright , 2001, business wire) san francisco--(business wire)--april 6, 2001--pacific gas and electric company, the utility unit of pg&e corporation (nyse: pcg), today filed for reorganization under chapter 11 of the u.s. bankruptcy code in san francisco bankruptcy court. the company said it is taking this action in light of its unreimbursed energy costs which are now increasing by more than $300 million per month, continuing cpuc decisions that economically disadvantage the company, and the now unmistakable fact that negotiations with governor gray davis and his representatives are going nowhere. neither pg&e corporation nor any of its other subsidiaries, including its national energy group, have filed for chapter 11 reorganization or are affected by the utility is filing', '.m. pacific daylight time today. a real-time webcast of this conference call can be accessed at www.pgecorp.com. contact: pg&e corporation news department 415/973-5930 we will make up the difference for you and eldon. prentice is doing some independent research. nancy sellers <nancy.sellers@robertmondavi.com> 04/06/2001 12:00 pm i have been trying to research our time share alternatives in cabo. there are two with golf courses. one page is attached. the per person rate for golf is $160 per round. our comparable rate was $61.00. <<cabo san lucas country club, rates and reservations.htm>> - cabo san lucas country club, rates and reservations.htm - yahoo - pacific gas and electric company files for chapter 11 reorganization.htm jean munoz <jmunoz@mcnallytemple.com> 04/06/2001 02:05 pm sce responds to pg&e bankruptcy filing southern california edison company (sce) released the following statement in response to the decision today by pacific gas and electric to file for reorganization under chapter 11 of the u.s', "". tha= nks. (this is going to blow the roof off in california.) best, jeff it is out ... for immediate release=09september 20, 2001 contact: pg&e news department (415) 973-5930 pacific gas and electric company and pg&e corporation file plan of reorgani= zation=20 plan pays claims in full, does not call for retail rate increases or state = bailout (san francisco, ca)- pg&e corporation (nyse: pcg) and its utility unit paci= fic gas and electric company jointly filed a plan of reorganization in u.s.= bankruptcy court today that enables pacific gas and electric company to pa= y all valid creditor claims in full and emerge from chapter 11 bankruptcy p= roceedings. the official creditors' committee supports the plan""]","Unreimbursed energy costs, CPUC decisions, and failed negotiations with the Governor.","2","4","1","3","5","0.14","22","-"
"What new end date has been set for the Park & Loan contracts listed in the documents?","The new end date for the Park & Loan contracts listed in the documents has been extended to October 31, 2001.","['the end date on the following park & loan contracts has been extended from 9/30/01 to 10/31/01. contract deal 37874 1075382 37875 1075388 37876 1075391 37877 1075393 37878 1075407 37879 1075408 i had to create new sitara numbers because the old deal numbers were ""baseload"" instead of ""term"". robert, rhonda may be adjusting the leach volume (14,288) up or down a few dth is to balance every day. that is ok. somebody tell barker what a nice guy i am. i did a buy/sale with ees where ees will give me tco pool gas and i will give ees tco pool or cglf leach gas. the volume is 14,288 per day. the purchase deal is 1068442, at cgas if. this deal will not change. the sale deal is #1068455, at cgas if - .05. i have 2 meters on this deal, kimat, let me know if that will be a problem booking the deal in tagg. robert, please chat with rhonda on which contract to use. we need to use the same gulf contract all month long. it would probably be easier for rhonda if we use the same contract we used this month', '. energyjobsnetwork.com i did the following deals with ms overton yesterday. rolled the park & loans to november. purchased 3 transport contracts - 500l to broad run. 1. 2500 day for nov-jan 2. 2500 day for feb-mar 3. 3893 day for nov only. did you get my email from last nite! if not, here it is again. bethany united methodist please grant the following origination to robin from the tp1 book. thanks the following deals i put in your book and would like to have origination granted for them. customer - national fuel sitara 1110335 bought from im ontario sitara 1110281 rec/del pt - niagara eff date vol purchase price sell price $ 10-18 5000 3.005 3.02 75 10-26 17149 3.45 3.46 171 10-26 2851 3.485 3.5 43 10-30 20000 3.42 3.43 200 10-30 15000 3.45 3.46 150 total $639 i extended the term date on the following park and loan contracts from oct 31 to nov 30', '. then you can set up the deals in sitara. let me know if you have any problems. thank you. what do you guys think about the following set ups for the egan park and loan contracts? parking loaning pipe code eghp eghp firmness it it service type interruptible parking service interruptible loaning service rate schedule ips ils term term term contract # eghp it parking - 001 eghp it loaning - 001 thanks. these two new offered service have been setup for egan hub. i have called to have the server bounced. it will take about 15-20 minutes. then you can set up the deals in sitara. let me know if you have any problems. thank you. what do you guys think about the following set ups for the egan park and loan contracts? parking loaning pipe code eghp eghp firmness it it service type interruptible parking service interruptible loaning service rate schedule ips ils term term term contract # eghp it parking - 001 eghp it loaning - 001 the end date on #21 (contract # 58654) is 4/30/2005', '. please park outside the complex. walk-in gates on augusta and sugar hill. my apartment is #33. we will be at the pool, in the middle of the complex... just follow the noise. if i left someone out... it was unintentional!! please pass the invite to mutual friends. because of limited accommodations, please do not invite all of houston!!! hey team. i need the following services set up on national fuel. ias <== we just created k# a02353 iss <== i think we already have this set up on k#h02262 fss <== nat fuel has not assigned this contract to us yet. believe me, this all happened really fast. i just sent some of the paperwork to legal and i need it back by monday morning. chris germany 06/23/2000 02:35 pm we have a new park & loan / storage deal on national fuel effective 6/23/2000. national fuel transferred 1,000,000 dth from our parking contract to our brand new firm storage contract. we are now long fss and short pals. fss we have the rights to withdraw on a firm basis up to 33,333 dth per day', '. scott this transaction involves 5 contracts. nat fuel is billing ena a total of ($.125 x 1,000,000 dth) or $41,666.67/month for 3 months. i do not think nat fuel knows how we will be billed yet so i am going to show this as a demand charge on contract a02353 until we figure it out. chris germany 06/23/2000 03:56 pm hey team. i need the following services set up on national fuel. ias <== we just created k# a02353 iss <== i think we already have this set up on k#h02262 fss <== nat fuel has not assigned this contract to us yet. believe me, this all happened really fast. i just sent some of the paperwork to legal and i need it back by monday morning. chris germany 06/23/2000 02:35 pm we have a new park & loan / storage deal on national fuel effective 6/23/2000. national fuel transferred 1,000,000 dth from our parking contract to our brand new firm storage contract. we are now long fss and short pals. fss we have the rights to withdraw on a firm basis up to 33,333 dth per day']","The new end date for the Park & Loan contracts listed in the documents has been extended from September 30, 2001, to October 31, 2001. The following contracts are affected:

- Contract 37874, Deal 1075382
- Contract 37875, Deal 1075388
- Contract 37876, Deal 1075391
- Contract 37877, Deal 1075393
- Contract 37878, Deal 1075407
- Contract 37879, Deal 1075408","1","5","3","5","1","0.52","23","-"
"What are the key details about GS's valuation of ENE shares?","The provided information does not specifically detail Goldman Sachs's (GS) valuation of ENE shares. However, it does include relevant details about the valuation and merger context involving Enron (ENE) and Dynegy:

1. **Debt/Equity Ratio**: The combined company's debt/equity ratio is expected to be less than 45%.

2. **Ratings Watch**: Both companies will remain on ratings watch negative.

3. **ChevronTexaco's Stake**: ChevronTexaco will hold 169 million shares out of a total of 650 million shares in the post-merger entity.

4. **Financial Structure**: The new entity will focus on a transparent and clear financial structure with a significant reduction in on- and off-balance-sheet leverage.

5. **Valuation Approach**: The new entity will be run with a focus on cash flow rather than earnings, which is termed a ""new approach.""

6. **Merrill Lynch NAV Analysis**: Merrill Lynch performed a net asset value (NAV) analysis of Enron, arriving at an estimate in the $16 to $24 area. They suggest that employing a discounted 13-15x P/E on the firm's 2002 estimated earnings of $1.90-$2.10 produces a valuation of $24.70 to $31.50.

7. **Convertible Preferred Investment**: The investment in Northern Natural takes the form of convertible preferred shares. If the merger does not proceed, Dynegy","['. enron executives spoke when questions were directed to them. specific points: ees will be a part of the new company. enron assets will be revalued at closing. the investment in northern natural takes the form of convertible preferred. if the merger does not go through, dynegy has the right to acquire northern for  havery little\' additional consideration. if dyn terminates the merger and ene \'has sufficient liquidity\', ene has right to repurchase the convertible preferred. debt/equity of combined company expected to be <45%. both companies will remain on ratingswatch negative. chevrontexaco will hold 169mm shares out of a total 650mm shares of the post-merger entity. watson reiterates that going forward, the new entity will be run with a focus on transparent and clear financial structure and disclosure, with a significant reduction in on- and off-balance-sheet leverage. in what was termed a ""new approach"", the new entity will be run with a focus on cash flow rather than earnings', '. enron executives spoke when questions were directed to them. specific points: ees will be a part of the new company. enron assets will be revalued at closing. the investment in northern natural takes the form of convertible preferred. if the merger does not go through, dynegy has the right to acquire northern for  havery little\' additional consideration. if dyn terminates the merger and ene \'has sufficient liquidity\', ene has right to repurchase the convertible preferred. debt/equity of combined company expected to be <45%. both companies will remain on ratingswatch negative. chevrontexaco will hold 169mm shares out of a total 650mm shares of the post-merger entity. watson reiterates that going forward, the new entity will be run with a focus on transparent and clear financial structure and disclosure, with a significant reduction in on- and off-balance-sheet leverage. in what was termed a ""new approach"", the new entity will be run with a focus on cash flow rather than earnings', '.com > > 13:37 et enron corp (ene) 12.60 +1.44 (+12.9%): --update-- merrill lynch > performs a nav analysis of enron. including off-balance sheet financing > (that firm is aware of), merrill arrives at nav estimate in the $16 to $24 > area. estimate could prove conservative as it does not include cash > balance or the current net trading position. thinks that once the air > clears and credibility begins to return, ene will ultimately return to a > more traditional valuation. employing a discounted 13-15x p/e on firm is > 2002 est of $1.90-$2.10 produces valuation of $24.70 to $31.50. > > ene sounds like a possible double from here. a no brainer? > last trade 0.70. success has worked for me so far. he screwed me... sold at $0.40 but i learned my lesson (could not get out of order)... but do not be so brash man... ""success is a lousy teacher. it makes smart people think that they cannot lose."" - bill gates sorry to freak on you. i am a little stressed', '. secondly, i have summarized my key ""take-aways"" as stated below. before conveying it to my management, however, i really appreciate it if you can pls review my conclusions and ensure that they are not miss-stated. again, thanks so much for your time and wisdom. i was also honored that you gave me a copy of the ""managing energy price risk"" book and shall reference it with interest. thank you. i really look forward to seeing you again next time i am in houston. best regards, soussan (914) 253-4187 ps. the latest fortune article on ene is a great read and substantiates the company is innovative and creative approach to business. our meeting was mainly focused on gaining additional insights re leading-edge practices within ene. my key findings are summarized below: 1. ene does not use corporate price premises. they use market price info only and adhere to mark-to-market accounting. 2', "". mcmahon says 'no comment' to wsj article indicating that ene is banks are preparing to make an equity infusion into ene in the next few weeks. consolidation of trading activity: mid- and back-office consolidation will see substantial progress prior to closing, such that only the front office / trading books will need to be combined at closing. ees, nng and tw have no real overlap with existing dyn activity, so there will not be much integration work required there. the big integration effort will be ena. watson says that the 'creative financing' surrounded non-core assets. doty adds that, 'frankly', dyn assigned zero economic value to non-core businesses in their valuation model. they bracketed the maximum expected exposure from the non-core assets/businesses and left it at that""]","In one of the documents, it is mentioned that Goldman Sachs (GS) is going to issue a report valuing Enron (ENE) shares at $68 each. This valuation seems significant as it mentions a specific price target which potentially reflects GS's analysis and outlook on Enron’s market performance.","2","1","3","1","3","0.17","24","-"
"What is the subject of James Stiglitz's criticism towards the IMF and U.S. Treasury policy?","James Stiglitz's criticism towards the IMF and U.S. Treasury policy centers on several key issues:

1. **Austerity Measures and Social Impact**: Stiglitz criticizes the IMF's imposition of austerity measures, which he argues have led to social unrest and economic instability. He refers to these uprisings as ""IMF riots"" and highlights the ethnic conflict in Indonesia as a consequence of such policies.

2. **Capital Flow Liberalization**: He questions the Treasury and IMF's insistence that emerging nations remove restrictions on capital flows. Stiglitz points out that vulnerability to ""hot money"" can exacerbate economic crises, noting that countries like China have achieved significant growth without fully convertible currencies.

3. **Crash Privatization in Russia**: Stiglitz argues that the rapid privatization in Russia, implemented without a functioning democratic, legal, or financial regulatory system, led to the creation of a corrupt oligarchy that hindered economic growth. He is particularly critical of the IMF's 1998 bailout of Russia, which he claims facilitated capital flight rather than economic stability.

4. **Policy of Conditionality**: Stiglitz objects to the IMF's policy of making loans contingent on extensive internal changes, arguing that these ""conditionalities"" go beyond what is necessary for loan repayment and often worsen the economic situation.

5. **Narrow Economic Models**: He criticizes the narrow economic models used by the Treasury and IMF, which failed to account for potential","['. indeed, austerity-inspired uprisings are routinely called ""imf riots."" but when he raised his doubts, within channels, he says, ""it was like hitting your head against the wall."" stiglitz has other pungent criticisms of the washington consensus: he questions the treasury/imf insistence that emerging nations end restrictions on capital flows. he points out that vulnerability to hot money can worsen crises, emphasizing that some countries, such as china, have achieved significant rates of growth without making their currencies fully convertible. he continues to criticize western policy toward russia. he argues that the crash privatization program, in a country with no working democratic, legal or financial regulatory system, created a corrupt new oligarchy that blocks economic growth. he is particularly biting about the imf is 1998 russian bailout. ""was this a good investment?"" he asks. ""you put in $6 billion ... that enables the oligarchs to take out $6 billion in capital flight the next day', '. ""so you ask yourself the question:  wouldo you remain silent and play the system, or do you speak out?\' why have a job with responsibility if you do not speak out?"" the imf imposed its plan, and just as stiglitz and the world bank had predicted, ethnic conflict swept across indonesia, leaving hundreds dead. by then, however, the economist was speaking out on indonesia and other international economic matters -- an action that earned him the enmity of lawrence summers, now secretary of the treasury, then in a lesser role at the agency, and other officials at the treasury and the imf. their hostility, he asserts, led to his departure from the world bank earlier this year. today, from the outside, stiglitz is increasing his criticism of the u.s. treasury/imf policy toward asia, latin america and russia, which is still fundamentally unchanged despite the great scare of 1997-98. stiglitz himself may not join the expected protests this week in washington at the imf/world bank annual meetings', '... that enables the oligarchs to take out $6 billion in capital flight the next day. clearly the country is worse off, and everybody knew it was going to happen."" he has strong objections to the imf is policy of ""conditionality"" -- of making loans to countries contingent on far-reaching internal changes. ""of course, any lender will need evidence the loan can be repaid,"" he recognizes. ""but the conditionalities the imf imposes have gone well beyond anything required for repayment."" now that stiglitz is outside the system, he is expanding his critique. he will divide his time between the brookings institution in washington, teaching at stanford and working on a book about his experiences on the inside. not surprisingly, he comes down hardest on the u.s. treasury/imf policymakers. they embody what stiglitz calls ""the theory of escalating commitment."" by that he means, ""the cost of continuing mistakes is borne by others, while the cost of admitting mistakes is borne by yourself', '. today, stiglitz still cannot hide his astonishment at these contractionary policies. the washington consensus argued that the measures were necessary to restore overseas investor confidence, stabilize falling exchange rates and attract capital back into the afflicted countries. but he points out that their economic models were far too narrow, and therefore doomed to fail. for example, the treasury/imf strategy ignored the potential for bankruptcies. the sky-high interest rates forced even sound companies in thailand and indonesia to the wall, which was not the best way to re-inspire foreign investors. at the same time, the sharp cuts in government spending stimulated violence across indonesia, which did not build confidence overseas, either. stiglitz insists that ""these political and social concerns are not outside the economic model."" he knew that over the years, unrest had been frequent in the developing world following the imposition of austerity plans', '. he suggested that the united states and the monetary fund had failed to acknowledge that their prescription for russia -- quick privatization of state-owned industries, an end to state oversight of the economy, abolition of price controls and an opening up to the rest of the world -- had not produced the intended results and indeed had left many people worse off. ""stiglitz has been a very strong advocate for the poor and the excluded, and he is been one of the best things in the world bank in the last decade,"" said seth amgott, a spokesman for oxfam, which promotes poverty-fighting policies. ""he is also been very pointed and insightful in discussing the role of the imf. we are not used to that kind of candor."" stiglitz won few friends among economists and policy makers at the treasury department and the monetary fund']","IMF/World Bank policy","NaN","NaN","NaN","5","NaN","0.01","25","-"
"What are the key issues discussed by Vince Kaminski in his communication to Ryan regarding LJM/Raptor-related transactions, and what conditions does he assert are necessary for him to support the valuations produced by his group?","The key issues discussed by Vince Kaminski in his communication to Ryan regarding LJM/Raptor-related transactions revolve around the reliability and accuracy of the valuations produced by his group. Kaminski expresses strong concerns about the inability to support these valuations due to the lack of examination of all related legal documents. He acknowledges that although his group did solid work based on verbal information, this is insufficient for guaranteeing the quality of the final product. Kaminski emphasizes that the transactions are too complex and controversial to bypass the due diligence requirements expected from any professional.

The conditions Kaminski asserts as necessary for him to support the valuations include:

1. **Examination of All Related Legal Documents**: Kaminski insists on the need to review all the legal documents related to the LJM/Raptor transactions. Without this, he cannot guarantee the accuracy of the valuations.

2. **Full Due Diligence**: He stresses that full due diligence is required to ensure the quality and reliability of the valuations. This involves thorough scrutiny and validation of all information, not just relying on verbal communications.

3. **Addressing Complexity and Controversy**: Kaminski highlights the complexity and controversial nature of the transactions, which necessitates a more rigorous approach to valuation.

Without meeting these conditions, Kaminski concludes that he cannot support the valuations produced by his group.","['. i feel strongly that i cannot support the valuations my group has produced so far for the ljm/raptor related transactions without examination of all the related legal documents. i feel that we did solid work based on verbal information, but i cannot guarantee the quality of the final product without looking at the contracts. these transactions are too complex and controversial to bypass due diligence requirements that you would expect from any professional. vince kaminski vince, i have it. rakesh rakesh, i have informed ryan siurek (cc rick buy) on oct 4 that i cannot sign off on any analysis done by our group without looking at full set of legal documents related to the ljm transactions. those documents were not provided and therefore we cannot sign off on any analysis done in the past. i have come to a conclusion that we cannot support the valuations based on verbal and often conflicting information, without doing full due diligence', '... > > on june 1, 2001 an email was sent regarding vince kaminski...will mr > kaminski be participating in the panel presentation co-authored with > yourself, charles baden-fuller, ian macmillan, and rita mcgrath? please > advise. if mr kaminski will be participating we will contact him regarding > his registration fee. if not, his name will be removed from the program. > > thank you... > > > sms executive office > 1310 krannert center > purdue university > w lafayette in 47907-1310 > usa > phone: 765-494-6984 > fax: 765-494-1533 > email: sms@mgmt.purdue.edu > website: www.smsweb.org marilyn yes, please call shirley (3-5290) to setup a meeting. vince vince: are you available to talk about it tomorrow (tuesday)? marilyn marilyn, krishna sent to me the information about the structure proposed by ubs . i shall review it during the weekend and we can talk about it on monday. vince http://www.ssrn.com/ attached is the latest issue of btu is weekly power mail: info@btu', '. customers of pacific gas and electric company do not have to buy products from these companies in order to continue to receive quality regulated services from the utility. ryan, in the follow up to the meeting we had on wednesday i would like to reinforce one point i made. i feel strongly that i cannot support the valuations my group has produced so far for the ljm/raptor related transactions without examination of all the related legal documents. i feel that we did solid work based on verbal information, but i cannot guarantee the quality of the final product without looking at the contracts. these transactions are too complex and controversial to bypass due diligence requirements that you would expect from any professional. vince kaminski ryan, in the follow up to the meeting we had on wednesday i would like to reinforce one point i made', '. in such case, you should destroy this message and kindly notify the sender by reply email. please advise immediately if you or your employer do not consent to internet email for messages of this kind. opinions, conclusions and other information in this message that do not relate to the official business of my firm shall be understood as neither given nor endorsed by it. rakesh, i have informed ryan siurek (cc rick buy) on oct 4 that i cannot sign off on any analysis done by our group without looking at full set of legal documents related to the ljm transactions. those documents were not provided and therefore we cannot sign off on any analysis done in the past. i have come to a conclusion that we cannot support the valuations based on verbal and often conflicting information, without doing full due diligence. feel free to provide the information to kimberly but, please, inform her i cannot support the quantitative analysis we have done in the past', '. he says that sriram is ""ready to go"", but that the other ny guys are ""kinda iffy"". he did say that they may become more interested in houston if they do not receive ny job offers within the next week or so. we have scheduled sriram to come in to interview with the group on thursday, 4/19, beginning at 9:00 am with you, vince. i will keep you posted if i hear anything more from scott. spoke with jinbaek kim today, and he is very excited about the offer to do a summer internship with the research group. we will get his offer letter out to him tomorrow, but he has indicated a definite verbal acceptance. i will be in tomorrow, but off friday. please call me with any questions you might have. thanks, molly x34804 vince j kaminski 04/11/2001 05:22 pm stinson, helyette can be reached at 413 549 5071 and geman@math.umass.edu. vince hi, i do not know if you have the attached document from ben parsons. as we discussed earlier, anita put me on your calendar for next tuesday at 2 pm to discuss the duffie project']","Vince Kaminski explains that he and his group have produced valuations for the LJM/Raptor-related transactions based on the verbal information provided during their Wednesday meeting. However, he feels strongly that he cannot support these valuations without first examining all the related legal documents. He asserts that due diligence is paramount, given the complexity and controversy surrounding these transactions. He emphasizes that professional expectations necessitate this level of scrutiny before endorsing the final product. 

Kaminski's crucial points are:
1. The importance of thorough examination of legal documents before supporting the valuations.
2. The solid but verbally based work of his group lacking the legal document confirmation.
3. The transactions' complexity and controversy necessitating due diligence.

Thus, Kaminski underscores the requirement of meticulously scrutinizing legal documents to ensure the quality and accuracy of the valuations.","5","5","3","5","5","0.51","26","-"
"Why does Janet Dietrich express concern about the EES operations in Alberta and Ontario?","Janet Dietrich expresses concern about the EES operations in Alberta and Ontario due to the potential for affiliate abuse and the unfair sharing of information. As EES shifts its focus towards serving smaller customers, these issues become more pronounced. Janet notes that when EES concentrated on national outsourcing, such concerns were less significant because their products spanned multiple jurisdictions. However, in recently opened or opening markets, these issues are particularly important as affiliates attempt to secure a large market share.","['. these folks would continue to work on esa is projects but would get the resources and support of the centralized body particularily in their negotiations with outside vendors including nepco and oec. it would also be another linkage into the samerican business from houston to help monitor and defray technical and development risk. lets see if kishkill and redmond get to the right answer. regards delainey steve, i only have the following suggestion for the office of the chairman paragraph: ""dave is forming an office of the chairman in ees. joining dave, in the office of the chairman, will be marty sunde, as president, global marketing services and dan leff, as president, global energy services. dan and marty have been instrumental in the development and execution of the successful ees business model. in addition, janet dietrich will join the office of the chairman as chief operating officer', "". also joining the office of the chairman of ees is janet dietrich as chief operating officer. janet, currently is managing director in enron americas, where she has been successful in many of enron wholesale is core businesses, including gas trading, risk management and structural origination. tom white will continue as vice chairman of ees and will focus on the development and expansion of ees' customer relationships. lou, tom, dan, marty and the entire ees organization have developed a great business model with great growth prospects. ees has become an essential part of enron is market valuation and growth story. this new leadership structure will enable ees to continue on its path of sustained growth and increasing profitability. john lavorato will succeed dave as president and ceo of enron americas. john has been an essential part of enron is energy trading success over the years and is a key part of enron wholesale services' continuing success story"", "". we are able to provide phone numbers and contacts through our trade groups. jim dave -- with ees' push into serving smaller customers, the issues in this situation -- potential affiliate abuse and unfair sharing of information -- will become more important. when ees focused on national outsourcing, this was less an issue because our products crossed many jurisdictions. this issue, of course, is especially important in recently opened or opening markets as the affiliates try and secure large market share. we are also watching for these activities in places like mi, va, and oh. jim janet r dietrich 08/27/2001 02:15 pm just fyi... eric letke 08/26/2001 07:35 pm sent by: eric letke i will get with hamb and patrick to strategize before we take any definitive action. this may be an opportunity to negotiate access to systems that have been previously blocked"", "". also joining the office of the chairman of ees is= janet dietrich as chief operating officer. janet, currently is managing d= irector in enron americas, where she has been successful in many of enron w= holesale is core businesses, including gas trading, risk management and stru= ctural origination. tom white will continue as vice chairman of ees and wi= ll focus on the development and expansion of ees' customer relationships. = lou, tom, dan, marty and the entire ees organization have developed a great= business model with great growth prospects. ees has become an essential p= art of enron is market valuation and growth story. this new leadership stru= cture will enable ees to continue on its path of sustained growth and incre= asing profitability. john lavorato will succeed dave as president and ceo of enron americas. jo= hn has been an essential part of enron is energy trading success over the ye= ars and is a key part of enron wholesale services' continuing success story="", "". dave is forming an office of the chairman in ees. joining dave in the offi= ce of the chairman are dan leff, president of ees, global energy services, = and marty sunde, president of ees, global marketing and services. dan and = marty have been instrumental in the development and execution of the succes= sful ees business model. also joining the office of the chairman of ees is= janet dietrich as chief operating officer. janet, currently is managing d= irector in enron americas, where she has been successful in many of enron w= holesale is core businesses, including gas trading, risk management and stru= ctural origination. tom white will continue as vice chairman of ees and wi= ll focus on the development and expansion of ees' customer relationships. = lou, tom, dan, marty and the entire ees organization have developed a great= business model with great growth prospects. ees has become an essential p= art of enron is market valuation and growth story""]","Janet Dietrich's concern stems from the negative potential net present value (NPV) of the Owens Corning gas and power positions in Alberta and Ontario. Specifically, the sale of gas at AECO Index + Cdn$1.73/GJ is underperforming due to the climbing costs of Nova, TCPL, and LDC demand, commodity, and fuel, resulting in an estimate by Brian Gillis indicating a significant financial loss. Additionally, sales of power in the Alberta market at Cdn$28/MWh in a $40 market and in the Ontario market at Cdn$41.33/MWh in a $48 market further contribute to these losses. The net impact of these positions is significantly negative, contrary to EES Houston’s forecast, which indicated a net gain.","2","3","4","3","3","0.21","27","-"
"Why was there a need to involve key personnel on EES retail risk management and structuring before transitioning to NETCO?","Based on the provided information, there was a need to involve key personnel in EES retail risk management and structuring before transitioning to NETCO for several reasons:

1. **Development of Commodity Skills**: Key personnel were essential to develop commodity skills that did not reside in the wholesale business. This was crucial for promptly and effectively pricing and structuring retail commodity transactions to the delivery point.

2. **Streamlining and Redeployment**: Involving key personnel allowed for the streamlining of the account delivery and management team. Staff could be redeployed to support the development of new business for EES Europe, ensuring that the organization remained efficient and effective.

3. **Effective Account Management**: Key personnel played a vital role in maintaining effective account management, which was a key capability for EES. Their involvement ensured that as deals with customers were closed, staffing needs could be reviewed and adjusted accordingly.

4. **Coordination with Wholesale Business**: It was vital to remain totally coordinated with the wholesale business for price risk management services. Key personnel ensured this coordination, which was necessary for the seamless transition and continued growth of EES.

5. **Formation of New Risk Groups**: The formation of two new risk groups inside Enron Americas required experienced leadership. Key personnel like Rogers Herndon and Don Black were appointed to manage these functions, providing EES with the necessary systems, resources, and risk expertise from the wholesale energy groups.

6. **Growth and Market Opportunities**: Given the growth in","['. whilst it is vital that we remain totally coordinated with the wholesale business for price risk management services, there will be a renewed emphasis within ees europe to develop those commodity skills that do not reside in the wholesale business to allow us to promptly and effectively price and structure retail commodity transactions to the delivery point. given the renewed focus outlined above, we have taken the opportunity to streamline the account delivery and management team, typically redeploying staff where they can immediately support the development of new business for ees europe. effective account management remains a key capability for ees and as we close deals with customers we will review our staffing need in this area. organisation after eighteen months working on establishing the outsourcing business in europe, ron bertasi has decided to transition back to the us during the first half of 2001', '. urs is erpag is core business and gives us a tremendous platform to create a pan european urs competence. expertise in supply side management has increasingly become an issue for the origination team in ees europe as we have begun to get into material deal development. whilst it is vital that we remain totally coordinated with the wholesale business for price risk management services, there will be a renewed emphasis within ees europe to develop those commodity skills that do not reside in the wholesale business to allow us to promptly and effectively price and structure retail commodity transactions to the delivery point. given the renewed focus outlined above, we have taken the opportunity to streamline the account delivery and management team, typically redeploying staff where they can immediately support the development of new business for ees europe. effective account management remains a key capability for ees and as we close deals with customers we will review our staffing need in this area', '. this will provide ees with the systems, resources and risk expertise of the wholesale energy groups necessary for it to continue to grow and take advantage of current market opportunities. with this in mind and in agreement with the management of ees, two new risk groups inside enron americas will be formed to provide ees with pricing, structuring, retail and wholesale commodity risk management, logistics and back-office services. these groups main function is to provide these services to ees. we have asked rogers herndon, currently vice president-trading in the eastern power group to manage this function in the eastern interconnect (this includes both gas and power). rogers will continue to report to kevin presto. we have asked don black, formerly vice president-ees risk management and sourcing, to manage this function in the western u.s. don will manage this group from houston and will report to tim belden', '. this will provide ees with the systems, resources and risk expertise of the wholesale energy groups necessary for it to continue to grow and take advantage of current market opportunities. with this in mind and in agreement with the management of ees, two new risk groups inside enron americas will be formed to provide ees with pricing, structuring, retail and wholesale commodity risk management, logistics and back-office services. these groups main function is to provide these services to ees. we have asked rogers herndon, currently vice president-trading in the eastern power group to manage this function in the eastern interconnect (this includes both gas and power). rogers will continue to report to kevin presto. we have asked don black, formerly vice president-ees risk management and sourcing, to manage this function in the western u.s. don will manage this group from houston and will report to tim belden', '. the p&l showed this deal at $40. i offered to meet in the middle at $39. kurt preferred to pull the tapes and review the deal with his day guy that did the deal. this is a heads up on the situation. given the growth in ees it has become apparent that it is time to consolidate the risk functions between ees and ews. this will provide ees with the systems, resources and risk expertise of the wholesale energy groups necessary for it to continue to grow and take advantage of current market opportunities. with this in mind and in agreement with the management of ees, two new risk groups inside enron americas will be formed to provide ees with pricing, structuring, retail and wholesale commodity risk management, logistics and back-office services. these groups main function is to provide these services to ees. we have asked rogers herndon, currently vice president-trading in the eastern power group to manage this function in the eastern interconnect (this includes both gas and power)']","Key personnel on EES retail risk management and structuring are crucial to discharge EES's retail risk contracts responsibly. Ensuring these personnel complete their obligations will allow for proper valuation and orderly termination or sale of the contracts, maximizing value for the estate. Their involvement is necessary to maintain continuity and mitigate any potential disruptions during the transition to NETCO, expected to take approximately four weeks.

These answers provide a comprehensive understanding of the discussions and actions being undertaken to manage financial and operational challenges within EES and associated entities, ensuring a strategic transition through the restructuring process.","1","1","1","5","3","0.23","28","-"
"What is the overall mood among employees regarding the possibility of illegal transactions and the upcoming employee meeting?","Based on the provided email data, the overall mood among employees regarding the possibility of illegal transactions and the upcoming employee meeting appears to be one of concern and unease. 

1. **Illegal Transactions:**
   - There is a clear indication of worry and suspicion among employees about potential illegal activities. One employee explicitly states, ""I wonder if we really did conduct illegal transactions - at this point - I would believe anything - this sucks."" This shows a heightened level of anxiety and distrust.
   - The mention of ""gifting clubs"" being potentially illegal pyramid schemes and the internal communication about it further adds to the concern about illegal activities within the company.

2. **Upcoming Employee Meeting:**
   - The anticipation of the upcoming employee meeting is marked by a sense of urgency and expectation. The same employee mentions, ""we have an employee meeting tomorrow - everyone is waiting to hear what Lay has to say,"" indicating that employees are eagerly awaiting clarification and information from leadership.
   - This sentiment is compounded by the backdrop of layoffs and negative publicity, which suggests that employees are looking for reassurance and answers from the meeting.

In summary, the mood among employees is a mixture of concern about illegal transactions and a sense of anticipation for the upcoming meeting, hoping it will address their worries and provide some clarity.","['you are dying to do. see you soon! _____ pam macaul information developer 713.918.3938 2.1427a _____ (see attached file: bmc_logo.gif) (see attached file: comp26(1).gif) i guess we know why it tanked now -- i wonder if we really did conduct illegal transactions - at this point - i would believe anything - this sucks -- we have an employee meeting tomorrow - everyone is waiting to here what lay has to say the 14th is much better for me as we already have plans on the 7th the two dates to choose from are december 7 and december 14 both on fridays due to company christmas party conflicts. we have decided to do it at two houses with heavy hors  would vours, dessert and drinks. the progressive dinner format takes too long and this will allow us to actually play with our husbands. please email me your date preference and i will get back with you on the date chosen and i will get back to you with all the other details. i do not think you would really want to be here right now anyway', '.doc - enron risk assessment matrix.doc fyi below find the proposed message that we intend to send to all us employees= =20 regarding the alleged ""gifting clubs."" i wanted you to be aware of the=20 company is position concerning these ""gifting clubs"" in the event that your= =20 staff was to receive any questions concerning this matter. thank you. kriste sullivan eb 4861 ext. 37557 =09kriste sullivan =09sent by: tanja murray =0907/28/2000 06:14 pm =09=09=20 below find a draft of the all employee communication regarding ""gifting=20 clubs."" please provide me with your comments. thank you. =01&the company has become aware that company employees have been solicited= for=20 participation in =01&gifting clubs.=018 these clubs appear to be illegal p= yramid=20 schemes. if you are approached about joining a club but aren=01,t sure if = it=01,s=20 an illegal gifting club, contact the better business bureau', '. in their suits, all filed over the last year or so, employees at microsoft, ford motor and conoco say the rating systems are unfair because they favor some groups of employees over others: white males over blacks and women, younger managers over older ones and foreign citizens over americans. a growing number of companies are turning to grading systems, also known as forced rankings or distributions, as a way of making sure managers evaluate employees honestly and make clearer distinctions among them. at companies that do not compare employees with one another this way, nearly every employee can come away feeling above average, like the children of lake wobegon. but under the grading system, managers are forced to identify some people as low performers. at general electric, for example, supervisors identify the top 20 percent and bottom 10 percent of their managerial and professional employees every year. the bottom 10 percent are not likely to stay. as john f. welch jr', '. ""john g klauberg"" <jklauber@llgm.com> 12/15/2000 03:07 pm fyi re: doj/ca situation. i am not sure what to make of this in light of the upcoming change in the administration, but i thought you would want to be aware of it. also, although the focus appears to be generators, i would assume that if doj elected to go forward andy investigation would be likely to expand to include major marketers. john friday december 15, 1:03 pm eastern time justice dept asked to probe power crisis washington (reuters) - u.s. attorney general janet reno has been asked to investigate whether possible collusion and other illegal activities among power generators are behind the huge jump in california is electricity and natural gas prices. ``we are concerned that market power is being abused by generators in the electricity market to inflate prices and gouge consumers,\'\' california democratic u.s. sen. barbara boxer and california state senate president pro tempore john burton said in a letter to reno late on thursday', '. and finally, this needs to be completed and returned to me by 1:00pm this wednesday, october 3. thank you, steve << file: aug 2001 g&a est.xls >> fyi. highly confidential fyi cc: del vecchio, peter importance: high sensitivity: confidential please see the attached memo regarding enron/dynegy agreement and plan of merger - compliance with the conduct of business covenants. sent on behalf of peter del vecchio by: martha keesler senior administrative assistant <<covenant.compliance.memo.3.doc>> i do not thing you need to until you get back. cannot open attachment in blackberry somber. i do not think people were surprised about the layoffs. i am planning to leave the office after the whalley meeting unless you need anything? how are thing going up there? thanks. what is the mood? thanks. you have a nice holiday too. will you have to work? things are ok. have a happy thansgiving meeting with whalley was interesting. they are laying off 2000 people next week']","The overall mood among employees appears to be one of concern and unease regarding the possibility of illegal transactions, as indicated by phrases such as 'I would believe anything' and 'this sucks'. The upcoming employee meeting is highly anticipated, with a noticeable level of anxiety as 'everyone is waiting to hear what Lay has to say'. Moreover, there is a sense of disillusionment, as seen in statements suggesting that the current environment is not favorable and that Houston is not an appealing place to be. This combination of skepticism, anticipation, and disillusionment highlights a tense atmosphere among the workforce.","3","4","4","1","3","0.41","29","-"
"What actions are being planned for the mass market customer list in Texas, New York, and Massachusetts?","Based on the provided information, the following actions are being planned for the mass market customer list in Texas, New York, and Massachusetts:

1. **Development of a Definitive Mass Market Customer List**: There is a plan to develop a definitive mass market customer list. This is mentioned in the context of working with deal capture to determine the sources of discrepancies and receiving bids.

2. **Processing Mass Market Contracts**: There is an ongoing effort to process the remaining 6,000 contracts, which requires additional resources. It is estimated that 12 people will need to work for one week to complete this task.

3. **Security and Access Setup**: Security access for the ""estate"" will be the same as the current production setup, while access for ""netco"" will need to be set up from scratch. This involves setting up access on a west, east, central, and Texas regional basis, including risk, logistics, trading, and other relevant personnel.

4. **Training and Observation**: There are plans for team members to spend time observing and understanding the processes involved in managing the mass market customer list and related activities.

These actions indicate a structured approach to both finalizing the customer list and ensuring the necessary infrastructure and training are in place to manage and utilize the list effectively.","['. we are working with deal capture to determine the sources of discrepancies. after receiving bids today, we will 1. determine to what extent we want to book and process remaininig deals, 2. develop a plan for developing the definitive mass market customer list. kevin just a quick update from shelly and i on where we stand with processing all of the mass market contracts. we will need more resources to process the remaining 6,000 contracts. we estimate that it would take 12 people 1 week', '. i imagine it will be more of an observing lesson than anything else, but i would like to stop by thursday morning. if you are available, what time should i come down there? zac would you mind sending russ the list of your people that will need access to sitara in netco. i have send him the list of traders. thanks. pl security access for the ""estate"" will be the same as production currently is. access for ""netco"" will have to be set up from scratch. can each of you give me a list of the people that should have access to ""netco"". access is still preliminarily being set up on a west, east, central and texas regional basis. included in the list should be risk, logistics, trading and anyone else that you know of that you want to have access to your region.. the plan is to have a large mass set up, additional updates will be handled under erequest, under the new application region code ""houston - netco"" (this name will be changed later) any questions or comments, please give me a call', '. i have send him the list of traders. thanks. pl security access for the ""estate"" will be the same as production currently is. access for ""netco"" will have to be set up from scratch. can each of you give me a list of the people that should have access to ""netco"". access is still preliminarily being set up on a west, east, central and texas regional basis. included in the list should be risk, logistics, trading and anyone else that you know of that you want to have access to your region.. the plan is to have a large mass set up, additional updates will be handled under erequest, under the new application region code ""houston - netco"" (this name will be changed later) any questions or comments, please give me a call. russ x37386 come down whenever, we can find something to show you. pl phillip, last week we discussed me spending time with you one morning to see exactly what it is that i will be doing', '.. the plan is to have a large mass set up, additional updates will be handled under erequest, under the new application region code ""houston - netco"" (this name will be changed later) any questions or comments, please give me a call. russ x37386 i still need a list of people who need netco sitara access for the east and central regions. russ security access for the ""estate"" will be the same as production currently is. access for ""netco"" will have to be set up from scratch. can each of you give me a list of the people that should have access to ""netco"". access is still preliminarily being set up on a west, east, central and texas regional basis. included in the list should be risk, logistics, trading and anyone else that you know of that you want to have access to your region.. the plan is to have a large mass set up, additional updates will be handled under erequest, under the new application region code ""houston - netco"" (this name will be changed later) any questions or comments, please give me a call', '.com sent by: owner-nyiso_tech_exchange@lists.thebiz.net barkerde@nmenergy.com writes to the nyiso_tech_exchange discussion list: for those that thought css (aka cit) was dead ( nyiso announcement may 2 ,mou mtg springfield mass. and c. king is 4/26 e mail) rejoice, it is alive and well .see below>>>> message sent from the pjm-customer-info mailing list at pjm-customer-info@majordomo.pjm.com: on june 12, pjm will implement the collaborative scheduling system (css), a new scheduling tool designed to facilitate transaction schedules between new york and pjm. css will become part of the ees tool now used to schedule transactions from and to pjm neighbors. pjm will offer several two-hour ""virtual"" workshops to introduce the new system. participants who now use ees and will use css are encouraged to attend one of these workshops. the dates for the workshops are: may 31 at 10:00 a.m., june 5 at 2:00 p.m. or june 11 at 2:00 p.m. the workshops will be presented on the internet with audio teleconference']","The proposed actions for the mass market customer list in Texas, New York, and Massachusetts include:
   - Ensuring all contracts are processed and booked appropriately to provide a clean list of contracts with corresponding values.
   - Up-scaling staffing temporarily, estimating that 12 additional people could process the remaining contracts within a week.
   - Booking transactions into RPS through the batch process in a timely manner to prepare for potential buyer acquisitions.
   These steps aim to ensure that these customer contracts are well-documented and transferrable to interested buyers.","3","4","4","3","4","0.28","30","-"
